1,23:13:03.242983 IP 172.28.0.20.42898 > 172.28.0.10.5000: Flags [S], seq 497362649, win 64240, options [mss 1460,sackOK,TS val 3894686283 ecr 0,nop,wscale 7], length 0
2,23:13:03.268033 IP 172.28.0.10.5000 > 172.28.0.20.42898: Flags [S.], seq 932320358, ack 497362650, win 65160, options [mss 1460,sackOK,TS val 2214075661 ecr 3894686283,nop,wscale 7], length 0
3,23:13:03.293109 IP 172.28.0.20.42898 > 172.28.0.10.5000: Flags [.], ack 1, win 502, options [nop,nop,TS val 3894686333 ecr 2214075661], length 0
4,23:13:03.293351 IP 172.28.0.20.42898 > 172.28.0.10.5000: Flags [P.], seq 1:39, ack 1, win 502, options [nop,nop,TS val 3894686333 ecr 2214075661], length 38
5,23:13:03.318371 IP 172.28.0.10.5000 > 172.28.0.20.42898: Flags [.], ack 39, win 509, options [nop,nop,TS val 2214075711 ecr 3894686333], length 0
6,23:13:03.343462 IP 172.28.0.20.42898 > 172.28.0.10.5000: Flags [P.], seq 39:89, ack 1, win 502, options [nop,nop,TS val 3894686383 ecr 2214075711], length 50
7,23:13:03.368494 IP 172.28.0.10.5000 > 172.28.0.20.42898: Flags [.], ack 89, win 509, options [nop,nop,TS val 2214075761 ecr 3894686383], length 0
8,23:13:03.369329 IP 172.28.0.10.5000 > 172.28.0.20.42898: Flags [P.], seq 1:3, ack 89, win 509, options [nop,nop,TS val 2214075762 ecr 3894686383], length 2
9,23:13:03.394389 IP 172.28.0.20.42898 > 172.28.0.10.5000: Flags [.], ack 3, win 502, options [nop,nop,TS val 3894686434 ecr 2214075762], length 0
10,23:13:03.394489 IP 172.28.0.20.42898 > 172.28.0.10.5000: Flags [P.], seq 89:2985, ack 3, win 502, options [nop,nop,TS val 3894686434 ecr 2214075762], length 2896
11,23:13:03.394503 IP 172.28.0.20.42898 > 172.28.0.10.5000: Flags [P.], seq 2985:4185, ack 3, win 502, options [nop,nop,TS val 3894686434 ecr 2214075762], length 1200
12,23:13:03.394537 IP 172.28.0.20.42898 > 172.28.0.10.5000: Flags [P.], seq 7081:9977, ack 3, win 502, options [nop,nop,TS val 3894686434 ecr 2214075762], length 2896
13,23:13:03.394542 IP 172.28.0.20.42898 > 172.28.0.10.5000: Flags [.], seq 9977:11425, ack 3, win 502, options [nop,nop,TS val 3894686434 ecr 2214075762], length 1448
14,23:13:03.394551 IP 172.28.0.20.42898 > 172.28.0.10.5000: Flags [P.], seq 11425:14321, ack 3, win 502, options [nop,nop,TS val 3894686434 ecr 2214075762], length 2896
15,23:13:03.419514 IP 172.28.0.10.5000 > 172.28.0.20.42898: Flags [.], ack 2985, win 555, options [nop,nop,TS val 2214075812 ecr 3894686434], length 0
16,23:13:03.419560 IP 172.28.0.10.5000 > 172.28.0.20.42898: Flags [.], ack 4185, win 623, options [nop,nop,TS val 2214075812 ecr 3894686434,nop,nop,sack 1 {7081:9977}], length 0
17,23:13:03.419561 IP 172.28.0.10.5000 > 172.28.0.20.42898: Flags [.], ack 4185, win 645, options [nop,nop,TS val 2214075812 ecr 3894686434,nop,nop,sack 1 {7081:11425}], length 0
18,23:13:03.419562 IP 172.28.0.10.5000 > 172.28.0.20.42898: Flags [.], ack 4185, win 690, options [nop,nop,TS val 2214075812 ecr 3894686434,nop,nop,sack 1 {7081:14321}], length 0
19,23:13:03.444591 IP 172.28.0.20.42898 > 172.28.0.10.5000: Flags [P.], seq 14321:17217, ack 3, win 502, options [nop,nop,TS val 3894686484 ecr 2214075812], length 2896
20,23:13:03.444602 IP 172.28.0.20.42898 > 172.28.0.10.5000: Flags [P.], seq 17217:20113, ack 3, win 502, options [nop,nop,TS val 3894686484 ecr 2214075812], length 2896
21,23:13:03.444619 IP 172.28.0.20.42898 > 172.28.0.10.5000: Flags [P.], seq 20113:23009, ack 3, win 502, options [nop,nop,TS val 3894686484 ecr 2214075812], length 2896
22,23:13:03.444621 IP 172.28.0.20.42898 > 172.28.0.10.5000: Flags [P.], seq 23009:25905, ack 3, win 502, options [nop,nop,TS val 3894686484 ecr 2214075812], length 2896
23,23:13:03.444624 IP 172.28.0.20.42898 > 172.28.0.10.5000: Flags [P.], seq 25905:28801, ack 3, win 502, options [nop,nop,TS val 3894686484 ecr 2214075812], length 2896
24,23:13:03.444626 IP 172.28.0.20.42898 > 172.28.0.10.5000: Flags [.], seq 4185:5633, ack 3, win 502, options [nop,nop,TS val 3894686484 ecr 2214075812], length 1448
25,23:13:03.444640 IP 172.28.0.20.42898 > 172.28.0.10.5000: Flags [.], seq 5633:7081, ack 3, win 502, options [nop,nop,TS val 3894686484 ecr 2214075812], length 1448
26,23:13:03.469654 IP 172.28.0.10.5000 > 172.28.0.20.42898: Flags [.], ack 28801, win 607, options [nop,nop,TS val 2214075862 ecr 3894686484], length 0
27,23:13:03.494720 IP 172.28.0.20.42898 > 172.28.0.10.5000: Flags [P.], seq 28801:31697, ack 3, win 502, options [nop,nop,TS val 3894686534 ecr 2214075862], length 2896
28,23:13:03.494769 IP 172.28.0.20.42898 > 172.28.0.10.5000: Flags [P.], seq 31697:34593, ack 3, win 502, options [nop,nop,TS val 3894686534 ecr 2214075862], length 2896
29,23:13:03.494774 IP 172.28.0.20.42898 > 172.28.0.10.5000: Flags [P.], seq 34593:37489, ack 3, win 502, options [nop,nop,TS val 3894686534 ecr 2214075862], length 2896
30,23:13:03.494793 IP 172.28.0.20.42898 > 172.28.0.10.5000: Flags [P.], seq 37489:40385, ack 3, win 502, options [nop,nop,TS val 3894686534 ecr 2214075862], length 2896
31,23:13:03.494797 IP 172.28.0.20.42898 > 172.28.0.10.5000: Flags [P.], seq 40385:43281, ack 3, win 502, options [nop,nop,TS val 3894686534 ecr 2214075862], length 2896
32,23:13:03.494802 IP 172.28.0.20.42898 > 172.28.0.10.5000: Flags [.], seq 43281:44729, ack 3, win 502, options [nop,nop,TS val 3894686534 ecr 2214075862], length 1448
33,23:13:03.519750 IP 172.28.0.10.5000 > 172.28.0.20.42898: Flags [.], ack 31697, win 737, options [nop,nop,TS val 2214075912 ecr 3894686534], length 0
34,23:13:03.519799 IP 172.28.0.10.5000 > 172.28.0.20.42898: Flags [.], ack 34593, win 783, options [nop,nop,TS val 2214075912 ecr 3894686534], length 0
35,23:13:03.519800 IP 172.28.0.10.5000 > 172.28.0.20.42898: Flags [.], ack 37489, win 828, options [nop,nop,TS val 2214075913 ecr 3894686534], length 0
36,23:13:03.519805 IP 172.28.0.10.5000 > 172.28.0.20.42898: Flags [.], ack 40385, win 873, options [nop,nop,TS val 2214075913 ecr 3894686534], length 0
37,23:13:03.519806 IP 172.28.0.10.5000 > 172.28.0.20.42898: Flags [.], ack 43281, win 918, options [nop,nop,TS val 2214075913 ecr 3894686534], length 0
38,23:13:03.544819 IP 172.28.0.20.42898 > 172.28.0.10.5000: Flags [.], seq 44729:46177, ack 3, win 502, options [nop,nop,TS val 3894686585 ecr 2214075912], length 1448
39,23:13:03.544858 IP 172.28.0.20.42898 > 172.28.0.10.5000: Flags [P.], seq 46177:49073, ack 3, win 502, options [nop,nop,TS val 3894686585 ecr 2214075912], length 2896
40,23:13:03.544863 IP 172.28.0.20.42898 > 172.28.0.10.5000: Flags [P.], seq 49073:51969, ack 3, win 502, options [nop,nop,TS val 3894686585 ecr 2214075913], length 2896
41,23:13:03.544867 IP 172.28.0.20.42898 > 172.28.0.10.5000: Flags [P.], seq 51969:54865, ack 3, win 502, options [nop,nop,TS val 3894686585 ecr 2214075913], length 2896
42,23:13:03.544872 IP 172.28.0.20.42898 > 172.28.0.10.5000: Flags [P.], seq 54865:57761, ack 3, win 502, options [nop,nop,TS val 3894686585 ecr 2214075913], length 2896
43,23:13:03.560797 IP 172.28.0.10.5000 > 172.28.0.20.42898: Flags [.], ack 44729, win 941, options [nop,nop,TS val 2214075954 ecr 3894686534], length 0
44,23:13:03.569852 IP 172.28.0.10.5000 > 172.28.0.20.42898: Flags [.], ack 46177, win 964, options [nop,nop,TS val 2214075963 ecr 3894686585], length 0
45,23:13:03.569884 IP 172.28.0.10.5000 > 172.28.0.20.42898: Flags [.], ack 49073, win 1009, options [nop,nop,TS val 2214075963 ecr 3894686585], length 0
46,23:13:03.569885 IP 172.28.0.10.5000 > 172.28.0.20.42898: Flags [.], ack 51969, win 1054, options [nop,nop,TS val 2214075963 ecr 3894686585], length 0
47,23:13:03.569886 IP 172.28.0.10.5000 > 172.28.0.20.42898: Flags [.], ack 54865, win 1099, options [nop,nop,TS val 2214075963 ecr 3894686585], length 0
48,23:13:03.569887 IP 172.28.0.10.5000 > 172.28.0.20.42898: Flags [.], ack 57761, win 1145, options [nop,nop,TS val 2214075963 ecr 3894686585], length 0
49,23:13:03.585866 IP 172.28.0.20.42898 > 172.28.0.10.5000: Flags [P.], seq 57761:60657, ack 3, win 502, options [nop,nop,TS val 3894686626 ecr 2214075954], length 2896
50,23:13:03.594916 IP 172.28.0.20.42898 > 172.28.0.10.5000: Flags [.], seq 60657:62105, ack 3, win 502, options [nop,nop,TS val 3894686635 ecr 2214075963], length 1448
51,23:13:03.594968 IP 172.28.0.20.42898 > 172.28.0.10.5000: Flags [P.], seq 62105:65001, ack 3, win 502, options [nop,nop,TS val 3894686635 ecr 2214075963], length 2896
52,23:13:03.594974 IP 172.28.0.20.42898 > 172.28.0.10.5000: Flags [P.], seq 65001:67897, ack 3, win 502, options [nop,nop,TS val 3894686635 ecr 2214075963], length 2896
53,23:13:03.594979 IP 172.28.0.20.42898 > 172.28.0.10.5000: Flags [P.], seq 67897:70793, ack 3, win 502, options [nop,nop,TS val 3894686635 ecr 2214075963], length 2896
54,23:13:03.594984 IP 172.28.0.20.42898 > 172.28.0.10.5000: Flags [P.], seq 70793:73689, ack 3, win 502, options [nop,nop,TS val 3894686635 ecr 2214075963], length 2896
55,23:13:03.610904 IP 172.28.0.10.5000 > 172.28.0.20.42898: Flags [.], ack 60657, win 1190, options [nop,nop,TS val 2214076004 ecr 3894686626], length 0
56,23:13:03.619947 IP 172.28.0.10.5000 > 172.28.0.20.42898: Flags [.], ack 62105, win 1213, options [nop,nop,TS val 2214076013 ecr 3894686635], length 0
57,23:13:03.619989 IP 172.28.0.10.5000 > 172.28.0.20.42898: Flags [.], ack 65001, win 1258, options [nop,nop,TS val 2214076013 ecr 3894686635], length 0
58,23:13:03.619990 IP 172.28.0.10.5000 > 172.28.0.20.42898: Flags [.], ack 67897, win 1303, options [nop,nop,TS val 2214076013 ecr 3894686635], length 0
59,23:13:03.619991 IP 172.28.0.10.5000 > 172.28.0.20.42898: Flags [.], ack 70793, win 1348, options [nop,nop,TS val 2214076013 ecr 3894686635], length 0
60,23:13:03.619998 IP 172.28.0.10.5000 > 172.28.0.20.42898: Flags [.], ack 73689, win 1394, options [nop,nop,TS val 2214076013 ecr 3894686635], length 0
61,23:13:03.635990 IP 172.28.0.20.42898 > 172.28.0.10.5000: Flags [P.], seq 73689:76585, ack 3, win 502, options [nop,nop,TS val 3894686676 ecr 2214076004], length 2896
62,23:13:03.636032 IP 172.28.0.20.42898 > 172.28.0.10.5000: Flags [.], seq 76585:78033, ack 3, win 502, options [nop,nop,TS val 3894686676 ecr 2214076004], length 1448
63,23:13:03.645008 IP 172.28.0.20.42898 > 172.28.0.10.5000: Flags [.], seq 78033:79481, ack 3, win 502, options [nop,nop,TS val 3894686685 ecr 2214076013], length 1448
64,23:13:03.645056 IP 172.28.0.20.42898 > 172.28.0.10.5000: Flags [P.], seq 79481:82377, ack 3, win 502, options [nop,nop,TS val 3894686685 ecr 2214076013], length 2896
65,23:13:03.645061 IP 172.28.0.20.42898 > 172.28.0.10.5000: Flags [P.], seq 82377:85273, ack 3, win 502, options [nop,nop,TS val 3894686685 ecr 2214076013], length 2896
66,23:13:03.645066 IP 172.28.0.20.42898 > 172.28.0.10.5000: Flags [P.], seq 85273:88169, ack 3, win 502, options [nop,nop,TS val 3894686685 ecr 2214076013], length 2896
67,23:13:03.645069 IP 172.28.0.20.42898 > 172.28.0.10.5000: Flags [P.], seq 88169:91065, ack 3, win 502, options [nop,nop,TS val 3894686685 ecr 2214076013], length 2896
68,23:13:03.661041 IP 172.28.0.10.5000 > 172.28.0.20.42898: Flags [.], ack 76585, win 1439, options [nop,nop,TS val 2214076054 ecr 3894686676], length 0
69,23:13:03.661051 IP 172.28.0.10.5000 > 172.28.0.20.42898: Flags [.], ack 78033, win 1461, options [nop,nop,TS val 2214076054 ecr 3894686676], length 0
70,23:13:03.670047 IP 172.28.0.10.5000 > 172.28.0.20.42898: Flags [.], ack 79481, win 1484, options [nop,nop,TS val 2214076063 ecr 3894686685], length 0
71,23:13:03.670070 IP 172.28.0.10.5000 > 172.28.0.20.42898: Flags [.], ack 82377, win 1490, options [nop,nop,TS val 2214076063 ecr 3894686685], length 0
72,23:13:03.670071 IP 172.28.0.10.5000 > 172.28.0.20.42898: Flags [.], ack 85273, win 1468, options [nop,nop,TS val 2214076063 ecr 3894686685], length 0
73,23:13:03.670076 IP 172.28.0.10.5000 > 172.28.0.20.42898: Flags [.], ack 88169, win 1467, options [nop,nop,TS val 2214076063 ecr 3894686685], length 0
74,23:13:03.670077 IP 172.28.0.10.5000 > 172.28.0.20.42898: Flags [.], ack 91065, win 1445, options [nop,nop,TS val 2214076063 ecr 3894686685], length 0
75,23:13:03.686129 IP 172.28.0.20.42898 > 172.28.0.10.5000: Flags [P.], seq 91065:93961, ack 3, win 502, options [nop,nop,TS val 3894686726 ecr 2214076054], length 2896
76,23:13:03.695107 IP 172.28.0.20.42898 > 172.28.0.10.5000: Flags [P.], seq 93961:96857, ack 3, win 502, options [nop,nop,TS val 3894686735 ecr 2214076063], length 2896
77,23:13:03.695150 IP 172.28.0.20.42898 > 172.28.0.10.5000: Flags [P.], seq 96857:99753, ack 3, win 502, options [nop,nop,TS val 3894686735 ecr 2214076063], length 2896
78,23:13:03.695155 IP 172.28.0.20.42898 > 172.28.0.10.5000: Flags [P.], seq 99753:102649, ack 3, win 502, options [nop,nop,TS val 3894686735 ecr 2214076063], length 2896
79,23:13:03.695160 IP 172.28.0.20.42898 > 172.28.0.10.5000: Flags [P.], seq 102649:105545, ack 3, win 502, options [nop,nop,TS val 3894686735 ecr 2214076063], length 2896
80,23:13:03.695165 IP 172.28.0.20.42898 > 172.28.0.10.5000: Flags [P.], seq 105545:108441, ack 3, win 502, options [nop,nop,TS val 3894686735 ecr 2214076063], length 2896
81,23:13:03.711157 IP 172.28.0.10.5000 > 172.28.0.20.42898: Flags [.], ack 93961, win 1490, options [nop,nop,TS val 2214076104 ecr 3894686726], length 0
82,23:13:03.720144 IP 172.28.0.10.5000 > 172.28.0.20.42898: Flags [.], ack 96857, win 1490, options [nop,nop,TS val 2214076113 ecr 3894686735], length 0
83,23:13:03.720175 IP 172.28.0.10.5000 > 172.28.0.20.42898: Flags [.], ack 99753, win 1490, options [nop,nop,TS val 2214076113 ecr 3894686735], length 0
84,23:13:03.720176 IP 172.28.0.10.5000 > 172.28.0.20.42898: Flags [.], ack 102649, win 1468, options [nop,nop,TS val 2214076113 ecr 3894686735], length 0
85,23:13:03.720176 IP 172.28.0.10.5000 > 172.28.0.20.42898: Flags [.], ack 105545, win 1446, options [nop,nop,TS val 2214076113 ecr 3894686735], length 0
86,23:13:03.720177 IP 172.28.0.10.5000 > 172.28.0.20.42898: Flags [.], ack 108441, win 1424, options [nop,nop,TS val 2214076113 ecr 3894686735], length 0
87,23:13:03.745208 IP 172.28.0.20.42898 > 172.28.0.10.5000: Flags [P.], seq 111337:114233, ack 3, win 502, options [nop,nop,TS val 3894686785 ecr 2214076113], length 2896
88,23:13:03.745243 IP 172.28.0.20.42898 > 172.28.0.10.5000: Flags [P.], seq 114233:117129, ack 3, win 502, options [nop,nop,TS val 3894686785 ecr 2214076113], length 2896
89,23:13:03.745248 IP 172.28.0.20.42898 > 172.28.0.10.5000: Flags [P.], seq 117129:120025, ack 3, win 502, options [nop,nop,TS val 3894686785 ecr 2214076113], length 2896
90,23:13:03.745252 IP 172.28.0.20.42898 > 172.28.0.10.5000: Flags [.], seq 120025:121473, ack 3, win 502, options [nop,nop,TS val 3894686785 ecr 2214076113], length 1448
91,23:13:03.745256 IP 172.28.0.20.42898 > 172.28.0.10.5000: Flags [P.], seq 121473:124369, ack 3, win 502, options [nop,nop,TS val 3894686785 ecr 2214076113], length 2896
92,23:13:03.745260 IP 172.28.0.20.42898 > 172.28.0.10.5000: Flags [.], seq 124369:125817, ack 3, win 502, options [nop,nop,TS val 3894686785 ecr 2214076113], length 1448
93,23:13:03.770239 IP 172.28.0.10.5000 > 172.28.0.20.42898: Flags [.], ack 108441, win 1490, options [nop,nop,TS val 2214076163 ecr 3894686735,nop,nop,sack 1 {111337:114233}], length 0
94,23:13:03.770296 IP 172.28.0.10.5000 > 172.28.0.20.42898: Flags [.], ack 108441, win 1490, options [nop,nop,TS val 2214076163 ecr 3894686735,nop,nop,sack 1 {111337:117129}], length 0
95,23:13:03.770297 IP 172.28.0.10.5000 > 172.28.0.20.42898: Flags [.], ack 108441, win 1490, options [nop,nop,TS val 2214076163 ecr 3894686735,nop,nop,sack 1 {111337:120025}], length 0
96,23:13:03.770298 IP 172.28.0.10.5000 > 172.28.0.20.42898: Flags [.], ack 108441, win 1490, options [nop,nop,TS val 2214076163 ecr 3894686735,nop,nop,sack 1 {111337:121473}], length 0
97,23:13:03.770298 IP 172.28.0.10.5000 > 172.28.0.20.42898: Flags [.], ack 108441, win 1490, options [nop,nop,TS val 2214076163 ecr 3894686735,nop,nop,sack 1 {111337:124369}], length 0
98,23:13:03.770299 IP 172.28.0.10.5000 > 172.28.0.20.42898: Flags [.], ack 108441, win 1490, options [nop,nop,TS val 2214076163 ecr 3894686735,nop,nop,sack 1 {111337:125817}], length 0
99,23:13:03.795333 IP 172.28.0.20.42898 > 172.28.0.10.5000: Flags [P.], seq 125817:128713, ack 3, win 502, options [nop,nop,TS val 3894686835 ecr 2214076163], length 2896
100,23:13:03.795368 IP 172.28.0.20.42898 > 172.28.0.10.5000: Flags [.], seq 108441:109889, ack 3, win 502, options [nop,nop,TS val 3894686835 ecr 2214076163], length 1448
101,23:13:03.795386 IP 172.28.0.20.42898 > 172.28.0.10.5000: Flags [.], seq 109889:111337, ack 3, win 502, options [nop,nop,TS val 3894686835 ecr 2214076163], length 1448
102,23:13:03.795396 IP 172.28.0.20.42898 > 172.28.0.10.5000: Flags [.], seq 128713:130161, ack 3, win 502, options [nop,nop,TS val 3894686835 ecr 2214076163], length 1448
103,23:13:03.795399 IP 172.28.0.20.42898 > 172.28.0.10.5000: Flags [P.], seq 130161:133057, ack 3, win 502, options [nop,nop,TS val 3894686835 ecr 2214076163], length 2896
104,23:13:03.795401 IP 172.28.0.20.42898 > 172.28.0.10.5000: Flags [.], seq 133057:134505, ack 3, win 502, options [nop,nop,TS val 3894686835 ecr 2214076163], length 1448
105,23:13:03.820400 IP 172.28.0.10.5000 > 172.28.0.20.42898: Flags [.], ack 109889, win 1479, options [nop,nop,TS val 2214076213 ecr 3894686835,nop,nop,sack 1 {111337:128713}], length 0
106,23:13:03.820408 IP 172.28.0.10.5000 > 172.28.0.20.42898: Flags [.], ack 128713, win 1377, options [nop,nop,TS val 2214076213 ecr 3894686835], length 0
107,23:13:03.820505 IP 172.28.0.10.5000 > 172.28.0.20.42898: Flags [.], ack 134505, win 1371, options [nop,nop,TS val 2214076213 ecr 3894686835], length 0
108,23:13:03.845481 IP 172.28.0.20.42898 > 172.28.0.10.5000: Flags [P.], seq 134505:137401, ack 3, win 502, options [nop,nop,TS val 3894686885 ecr 2214076213], length 2896
109,23:13:03.845507 IP 172.28.0.20.42898 > 172.28.0.10.5000: Flags [.], seq 137401:138849, ack 3, win 502, options [nop,nop,TS val 3894686885 ecr 2214076213], length 1448
110,23:13:03.845537 IP 172.28.0.20.42898 > 172.28.0.10.5000: Flags [P.], seq 138849:141745, ack 3, win 502, options [nop,nop,TS val 3894686885 ecr 2214076213], length 2896
111,23:13:03.845540 IP 172.28.0.20.42898 > 172.28.0.10.5000: Flags [P.], seq 141745:144641, ack 3, win 502, options [nop,nop,TS val 3894686885 ecr 2214076213], length 2896
112,23:13:03.845543 IP 172.28.0.20.42898 > 172.28.0.10.5000: Flags [.], seq 144641:146089, ack 3, win 502, options [nop,nop,TS val 3894686885 ecr 2214076213], length 1448
113,23:13:03.870516 IP 172.28.0.10.5000 > 172.28.0.20.42898: Flags [.], ack 137401, win 1490, options [nop,nop,TS val 2214076263 ecr 3894686885], length 0
114,23:13:03.870590 IP 172.28.0.10.5000 > 172.28.0.20.42898: Flags [.], ack 146089, win 1476, options [nop,nop,TS val 2214076263 ecr 3894686885], length 0
115,23:13:03.895597 IP 172.28.0.20.42898 > 172.28.0.10.5000: Flags [P.], seq 146089:148985, ack 3, win 502, options [nop,nop,TS val 3894686935 ecr 2214076263], length 2896
116,23:13:03.895642 IP 172.28.0.20.42898 > 172.28.0.10.5000: Flags [P.], seq 148985:151881, ack 3, win 502, options [nop,nop,TS val 3894686935 ecr 2214076263], length 2896
117,23:13:03.895647 IP 172.28.0.20.42898 > 172.28.0.10.5000: Flags [P.], seq 154777:157673, ack 3, win 502, options [nop,nop,TS val 3894686935 ecr 2214076263], length 2896
118,23:13:03.895652 IP 172.28.0.20.42898 > 172.28.0.10.5000: Flags [.], seq 157673:159121, ack 3, win 502, options [nop,nop,TS val 3894686935 ecr 2214076263], length 1448
119,23:13:03.920636 IP 172.28.0.10.5000 > 172.28.0.20.42898: Flags [.], ack 148985, win 1490, options [nop,nop,TS val 2214076313 ecr 3894686935], length 0
120,23:13:03.920679 IP 172.28.0.10.5000 > 172.28.0.20.42898: Flags [.], ack 151881, win 1490, options [nop,nop,TS val 2214076313 ecr 3894686935], length 0
121,23:13:03.920681 IP 172.28.0.10.5000 > 172.28.0.20.42898: Flags [.], ack 151881, win 1490, options [nop,nop,TS val 2214076313 ecr 3894686935,nop,nop,sack 1 {154777:157673}], length 0
122,23:13:03.945701 IP 172.28.0.20.42898 > 172.28.0.10.5000: Flags [P.], seq 159121:162017, ack 3, win 502, options [nop,nop,TS val 3894686985 ecr 2214076313], length 2896
123,23:13:03.945721 IP 172.28.0.20.42898 > 172.28.0.10.5000: Flags [P.], seq 162017:164913, ack 3, win 502, options [nop,nop,TS val 3894686985 ecr 2214076313], length 2896
124,23:13:03.945724 IP 172.28.0.20.42898 > 172.28.0.10.5000: Flags [P.], seq 164913:167809, ack 3, win 502, options [nop,nop,TS val 3894686985 ecr 2214076313], length 2896
125,23:13:03.971841 IP 172.28.0.10.5000 > 172.28.0.20.42898: Flags [.], ack 151881, win 1490, options [nop,nop,TS val 2214076363 ecr 3894686935,nop,nop,sack 1 {154777:167809}], length 0
126,23:13:03.996909 IP 172.28.0.20.42898 > 172.28.0.10.5000: Flags [.], seq 153329:154777, ack 3, win 502, options [nop,nop,TS val 3894687037 ecr 2214076363], length 1448
127,23:13:03.996919 IP 172.28.0.20.42898 > 172.28.0.10.5000: Flags [P.], seq 167809:170705, ack 3, win 502, options [nop,nop,TS val 3894687037 ecr 2214076363], length 2896
128,23:13:03.996924 IP 172.28.0.20.42898 > 172.28.0.10.5000: Flags [P.], seq 170705:173601, ack 3, win 502, options [nop,nop,TS val 3894687037 ecr 2214076363], length 2896
129,23:13:04.023040 IP 172.28.0.10.5000 > 172.28.0.20.42898: Flags [.], ack 151881, win 1490, options [nop,nop,TS val 2214076415 ecr 3894686935,nop,nop,sack 1 {153329:173601}], length 0
130,23:13:04.048146 IP 172.28.0.20.42898 > 172.28.0.10.5000: Flags [.], seq 151881:153329, ack 3, win 502, options [nop,nop,TS val 3894687088 ecr 2214076415], length 1448
131,23:13:04.048184 IP 172.28.0.20.42898 > 172.28.0.10.5000: Flags [P.], seq 173601:176497, ack 3, win 502, options [nop,nop,TS val 3894687088 ecr 2214076415], length 2896
132,23:13:04.048187 IP 172.28.0.20.42898 > 172.28.0.10.5000: Flags [P.], seq 176497:179393, ack 3, win 502, options [nop,nop,TS val 3894687088 ecr 2214076415], length 2896
133,23:13:04.048189 IP 172.28.0.20.42898 > 172.28.0.10.5000: Flags [.], seq 179393:180841, ack 3, win 502, options [nop,nop,TS val 3894687088 ecr 2214076415], length 1448
134,23:13:04.073196 IP 172.28.0.10.5000 > 172.28.0.20.42898: Flags [.], ack 173601, win 1368, options [nop,nop,TS val 2214076466 ecr 3894687088], length 0
135,23:13:04.073282 IP 172.28.0.10.5000 > 172.28.0.20.42898: Flags [.], ack 180841, win 1354, options [nop,nop,TS val 2214076466 ecr 3894687088], length 0
136,23:13:04.098288 IP 172.28.0.20.42898 > 172.28.0.10.5000: Flags [.], seq 180841:182289, ack 3, win 502, options [nop,nop,TS val 3894687138 ecr 2214076466], length 1448
137,23:13:04.098325 IP 172.28.0.20.42898 > 172.28.0.10.5000: Flags [P.], seq 182289:185185, ack 3, win 502, options [nop,nop,TS val 3894687138 ecr 2214076466], length 2896
138,23:13:04.098334 IP 172.28.0.20.42898 > 172.28.0.10.5000: Flags [.], seq 185185:186633, ack 3, win 502, options [nop,nop,TS val 3894687138 ecr 2214076466], length 1448
139,23:13:04.098337 IP 172.28.0.20.42898 > 172.28.0.10.5000: Flags [P.], seq 186633:189529, ack 3, win 502, options [nop,nop,TS val 3894687138 ecr 2214076466], length 2896
140,23:13:04.098340 IP 172.28.0.20.42898 > 172.28.0.10.5000: Flags [.], seq 189529:190977, ack 3, win 502, options [nop,nop,TS val 3894687138 ecr 2214076466], length 1448
141,23:13:04.123342 IP 172.28.0.10.5000 > 172.28.0.20.42898: Flags [.], ack 185185, win 1490, options [nop,nop,TS val 2214076516 ecr 3894687138], length 0
142,23:13:04.123380 IP 172.28.0.10.5000 > 172.28.0.20.42898: Flags [.], ack 190977, win 1462, options [nop,nop,TS val 2214076516 ecr 3894687138], length 0
143,23:13:04.148405 IP 172.28.0.20.42898 > 172.28.0.10.5000: Flags [P.], seq 190977:193873, ack 3, win 502, options [nop,nop,TS val 3894687188 ecr 2214076516], length 2896
144,23:13:04.148438 IP 172.28.0.20.42898 > 172.28.0.10.5000: Flags [P.], seq 193873:196769, ack 3, win 502, options [nop,nop,TS val 3894687188 ecr 2214076516], length 2896
145,23:13:04.148444 IP 172.28.0.20.42898 > 172.28.0.10.5000: Flags [P.], seq 196769:199665, ack 3, win 502, options [nop,nop,TS val 3894687188 ecr 2214076516], length 2896
146,23:13:04.148447 IP 172.28.0.20.42898 > 172.28.0.10.5000: Flags [.], seq 199665:201113, ack 3, win 502, options [nop,nop,TS val 3894687188 ecr 2214076516], length 1448
147,23:13:04.173434 IP 172.28.0.10.5000 > 172.28.0.20.42898: Flags [.], ack 193873, win 1490, options [nop,nop,TS val 2214076566 ecr 3894687188], length 0
148,23:13:04.173472 IP 172.28.0.10.5000 > 172.28.0.20.42898: Flags [.], ack 196769, win 1558, options [nop,nop,TS val 2214076566 ecr 3894687188], length 0
149,23:13:04.173473 IP 172.28.0.10.5000 > 172.28.0.20.42898: Flags [.], ack 201113, win 1550, options [nop,nop,TS val 2214076566 ecr 3894687188], length 0
150,23:13:04.198518 IP 172.28.0.20.42898 > 172.28.0.10.5000: Flags [P.], seq 204009:206905, ack 3, win 502, options [nop,nop,TS val 3894687238 ecr 2214076566], length 2896
151,23:13:04.198531 IP 172.28.0.20.42898 > 172.28.0.10.5000: Flags [P.], seq 206905:209801, ack 3, win 502, options [nop,nop,TS val 3894687238 ecr 2214076566], length 2896
152,23:13:04.198536 IP 172.28.0.20.42898 > 172.28.0.10.5000: Flags [.], seq 209801:211249, ack 3, win 502, options [nop,nop,TS val 3894687238 ecr 2214076566], length 1448
153,23:13:04.223543 IP 172.28.0.10.5000 > 172.28.0.20.42898: Flags [.], ack 201113, win 1564, options [nop,nop,TS val 2214076616 ecr 3894687188,nop,nop,sack 1 {204009:206905}], length 0
154,23:13:04.223546 IP 172.28.0.10.5000 > 172.28.0.20.42898: Flags [.], ack 201113, win 1564, options [nop,nop,TS val 2214076616 ecr 3894687188,nop,nop,sack 1 {204009:209801}], length 0
155,23:13:04.223548 IP 172.28.0.10.5000 > 172.28.0.20.42898: Flags [.], ack 201113, win 1564, options [nop,nop,TS val 2214076616 ecr 3894687188,nop,nop,sack 1 {204009:211249}], length 0
156,23:13:04.248609 IP 172.28.0.20.42898 > 172.28.0.10.5000: Flags [P.], seq 211249:214145, ack 3, win 502, options [nop,nop,TS val 3894687288 ecr 2214076616], length 2896
157,23:13:04.248634 IP 172.28.0.20.42898 > 172.28.0.10.5000: Flags [.], seq 202561:204009, ack 3, win 502, options [nop,nop,TS val 3894687288 ecr 2214076616], length 1448
158,23:13:04.273644 IP 172.28.0.10.5000 > 172.28.0.20.42898: Flags [.], ack 201113, win 1564, options [nop,nop,TS val 2214076666 ecr 3894687188,nop,nop,sack 1 {204009:214145}], length 0
159,23:13:04.274765 IP 172.28.0.10.5000 > 172.28.0.20.42898: Flags [.], ack 201113, win 1564, options [nop,nop,TS val 2214076666 ecr 3894687188,nop,nop,sack 1 {202561:214145}], length 0
160,23:13:04.298710 IP 172.28.0.20.42898 > 172.28.0.10.5000: Flags [P.], seq 214145:217041, ack 3, win 502, options [nop,nop,TS val 3894687338 ecr 2214076666], length 2896
161,23:13:04.299816 IP 172.28.0.20.42898 > 172.28.0.10.5000: Flags [.], seq 201113:202561, ack 3, win 502, options [nop,nop,TS val 3894687340 ecr 2214076666], length 1448
162,23:13:04.299839 IP 172.28.0.20.42898 > 172.28.0.10.5000: Flags [.], seq 217041:218489, ack 3, win 502, options [nop,nop,TS val 3894687340 ecr 2214076666], length 1448
163,23:13:04.324846 IP 172.28.0.10.5000 > 172.28.0.20.42898: Flags [.], ack 217041, win 1476, options [nop,nop,TS val 2214076718 ecr 3894687340], length 0
164,23:13:04.349913 IP 172.28.0.20.42898 > 172.28.0.10.5000: Flags [P.], seq 218489:221385, ack 3, win 502, options [nop,nop,TS val 3894687390 ecr 2214076718], length 2896
165,23:13:04.365811 IP 172.28.0.10.5000 > 172.28.0.20.42898: Flags [.], ack 218489, win 1587, options [nop,nop,TS val 2214076759 ecr 3894687340], length 0
166,23:13:04.374953 IP 172.28.0.10.5000 > 172.28.0.20.42898: Flags [.], ack 221385, win 1587, options [nop,nop,TS val 2214076768 ecr 3894687390], length 0
167,23:13:04.390864 IP 172.28.0.20.42898 > 172.28.0.10.5000: Flags [P.], seq 221385:224281, ack 3, win 502, options [nop,nop,TS val 3894687431 ecr 2214076759], length 2896
168,23:13:04.400309 IP 172.28.0.20.42898 > 172.28.0.10.5000: Flags [P.], seq 224281:227177, ack 3, win 502, options [nop,nop,TS val 3894687440 ecr 2214076768], length 2896
169,23:13:04.400326 IP 172.28.0.20.42898 > 172.28.0.10.5000: Flags [.], seq 227177:228625, ack 3, win 502, options [nop,nop,TS val 3894687440 ecr 2214076768], length 1448
170,23:13:04.415903 IP 172.28.0.10.5000 > 172.28.0.20.42898: Flags [.], ack 224281, win 1587, options [nop,nop,TS val 2214076809 ecr 3894687431], length 0
171,23:13:04.425351 IP 172.28.0.10.5000 > 172.28.0.20.42898: Flags [.], ack 228625, win 1573, options [nop,nop,TS val 2214076818 ecr 3894687440], length 0
172,23:13:04.440982 IP 172.28.0.20.42898 > 172.28.0.10.5000: Flags [P.], seq 228625:231521, ack 3, win 502, options [nop,nop,TS val 3894687481 ecr 2214076809], length 2896
173,23:13:04.450405 IP 172.28.0.20.42898 > 172.28.0.10.5000: Flags [P.], seq 231521:234417, ack 3, win 502, options [nop,nop,TS val 3894687490 ecr 2214076818], length 2896
174,23:13:04.450413 IP 172.28.0.20.42898 > 172.28.0.10.5000: Flags [.], seq 234417:235865, ack 3, win 502, options [nop,nop,TS val 3894687490 ecr 2214076818], length 1448
175,23:13:04.466020 IP 172.28.0.10.5000 > 172.28.0.20.42898: Flags [.], ack 231521, win 1587, options [nop,nop,TS val 2214076859 ecr 3894687481], length 0
176,23:13:04.475432 IP 172.28.0.10.5000 > 172.28.0.20.42898: Flags [.], ack 235865, win 1573, options [nop,nop,TS val 2214076868 ecr 3894687490], length 0
177,23:13:04.491089 IP 172.28.0.20.42898 > 172.28.0.10.5000: Flags [P.], seq 235865:238761, ack 3, win 502, options [nop,nop,TS val 3894687531 ecr 2214076859], length 2896
178,23:13:04.500495 IP 172.28.0.20.42898 > 172.28.0.10.5000: Flags [.], seq 241657:243105, ack 3, win 502, options [nop,nop,TS val 3894687540 ecr 2214076868], length 1448
179,23:13:04.516136 IP 172.28.0.10.5000 > 172.28.0.20.42898: Flags [.], ack 238761, win 1587, options [nop,nop,TS val 2214076909 ecr 3894687531], length 0
180,23:13:04.525519 IP 172.28.0.10.5000 > 172.28.0.20.42898: Flags [.], ack 238761, win 1587, options [nop,nop,TS val 2214076918 ecr 3894687531,nop,nop,sack 1 {241657:243105}], length 0
181,23:13:04.541234 IP 172.28.0.20.42898 > 172.28.0.10.5000: Flags [P.], seq 243105:246001, ack 3, win 502, options [nop,nop,TS val 3894687581 ecr 2214076909], length 2896
182,23:13:04.550590 IP 172.28.0.20.42898 > 172.28.0.10.5000: Flags [.], seq 246001:247449, ack 3, win 502, options [nop,nop,TS val 3894687590 ecr 2214076918], length 1448
183,23:13:04.565830 IP 172.28.0.20.42898 > 172.28.0.10.5000: Flags [.], seq 238761:240209, ack 3, win 502, options [nop,nop,TS val 3894687606 ecr 2214076918], length 1448
184,23:13:04.566261 IP 172.28.0.10.5000 > 172.28.0.20.42898: Flags [.], ack 238761, win 1587, options [nop,nop,TS val 2214076959 ecr 3894687531,nop,nop,sack 1 {241657:246001}], length 0
185,23:13:04.575616 IP 172.28.0.10.5000 > 172.28.0.20.42898: Flags [.], ack 238761, win 1587, options [nop,nop,TS val 2214076968 ecr 3894687531,nop,nop,sack 1 {241657:247449}], length 0
186,23:13:04.590859 IP 172.28.0.10.5000 > 172.28.0.20.42898: Flags [.], ack 240209, win 1576, options [nop,nop,TS val 2214076984 ecr 3894687606,nop,nop,sack 1 {241657:247449}], length 0
187,23:13:04.591311 IP 172.28.0.20.42898 > 172.28.0.10.5000: Flags [.], seq 240209:241657, ack 3, win 502, options [nop,nop,TS val 3894687631 ecr 2214076959], length 1448
188,23:13:04.600716 IP 172.28.0.20.42898 > 172.28.0.10.5000: Flags [.], seq 247449:248897, ack 3, win 502, options [nop,nop,TS val 3894687640 ecr 2214076968], length 1448
189,23:13:04.615981 IP 172.28.0.20.42898 > 172.28.0.10.5000: Flags [.], seq 248897:250345, ack 3, win 502, options [nop,nop,TS val 3894687656 ecr 2214076984], length 1448
190,23:13:04.616342 IP 172.28.0.10.5000 > 172.28.0.20.42898: Flags [.], ack 247449, win 1533, options [nop,nop,TS val 2214077009 ecr 3894687631], length 0
191,23:13:04.641024 IP 172.28.0.10.5000 > 172.28.0.20.42898: Flags [.], ack 250345, win 1573, options [nop,nop,TS val 2214077034 ecr 3894687640], length 0
192,23:13:04.641388 IP 172.28.0.20.42898 > 172.28.0.10.5000: Flags [P.], seq 250345:251793, ack 3, win 502, options [nop,nop,TS val 3894687681 ecr 2214077009], length 1448
193,23:13:04.666149 IP 172.28.0.20.42898 > 172.28.0.10.5000: Flags [P.], seq 251793:254689, ack 3, win 502, options [nop,nop,TS val 3894687706 ecr 2214077034], length 2896
194,23:13:04.666173 IP 172.28.0.20.42898 > 172.28.0.10.5000: Flags [.], seq 254689:256137, ack 3, win 502, options [nop,nop,TS val 3894687706 ecr 2214077034], length 1448
195,23:13:04.666422 IP 172.28.0.10.5000 > 172.28.0.20.42898: Flags [.], ack 251793, win 1587, options [nop,nop,TS val 2214077059 ecr 3894687681], length 0
196,23:13:04.691210 IP 172.28.0.10.5000 > 172.28.0.20.42898: Flags [.], ack 256137, win 1573, options [nop,nop,TS val 2214077084 ecr 3894687706], length 0
197,23:13:04.691458 IP 172.28.0.20.42898 > 172.28.0.10.5000: Flags [.], seq 256137:257585, ack 3, win 502, options [nop,nop,TS val 3894687731 ecr 2214077059], length 1448
198,23:13:04.716299 IP 172.28.0.20.42898 > 172.28.0.10.5000: Flags [P.], seq 257585:260481, ack 3, win 502, options [nop,nop,TS val 3894687756 ecr 2214077084], length 2896
199,23:13:04.716313 IP 172.28.0.20.42898 > 172.28.0.10.5000: Flags [.], seq 260481:261929, ack 3, win 502, options [nop,nop,TS val 3894687756 ecr 2214077084], length 1448
200,23:13:04.741341 IP 172.28.0.10.5000 > 172.28.0.20.42898: Flags [.], ack 261929, win 1573, options [nop,nop,TS val 2214077134 ecr 3894687731], length 0
201,23:13:04.766419 IP 172.28.0.20.42898 > 172.28.0.10.5000: Flags [P.], seq 261929:264825, ack 3, win 502, options [nop,nop,TS val 3894687806 ecr 2214077134], length 2896
202,23:13:04.766436 IP 172.28.0.20.42898 > 172.28.0.10.5000: Flags [P.], seq 264825:267721, ack 3, win 502, options [nop,nop,TS val 3894687806 ecr 2214077134], length 2896
203,23:13:04.791465 IP 172.28.0.10.5000 > 172.28.0.20.42898: Flags [.], ack 267721, win 1564, options [nop,nop,TS val 2214077184 ecr 3894687806], length 0
204,23:13:04.816562 IP 172.28.0.20.42898 > 172.28.0.10.5000: Flags [P.], seq 267721:270617, ack 3, win 502, options [nop,nop,TS val 3894687856 ecr 2214077184], length 2896
205,23:13:04.816589 IP 172.28.0.20.42898 > 172.28.0.10.5000: Flags [P.], seq 270617:273513, ack 3, win 502, options [nop,nop,TS val 3894687856 ecr 2214077184], length 2896
206,23:13:04.816592 IP 172.28.0.20.42898 > 172.28.0.10.5000: Flags [P.], seq 273513:276409, ack 3, win 502, options [nop,nop,TS val 3894687856 ecr 2214077184], length 2896
207,23:13:04.841600 IP 172.28.0.10.5000 > 172.28.0.20.42898: Flags [.], ack 270617, win 1564, options [nop,nop,TS val 2214077234 ecr 3894687856], length 0
208,23:13:04.841614 IP 172.28.0.10.5000 > 172.28.0.20.42898: Flags [.], ack 276409, win 1541, options [nop,nop,TS val 2214077234 ecr 3894687856], length 0
209,23:13:04.866712 IP 172.28.0.20.42898 > 172.28.0.10.5000: Flags [P.], seq 276409:279305, ack 3, win 502, options [nop,nop,TS val 3894687906 ecr 2214077234], length 2896
210,23:13:04.866732 IP 172.28.0.20.42898 > 172.28.0.10.5000: Flags [P.], seq 279305:282201, ack 3, win 502, options [nop,nop,TS val 3894687906 ecr 2214077234], length 2896
211,23:13:04.866736 IP 172.28.0.20.42898 > 172.28.0.10.5000: Flags [P.], seq 282201:285097, ack 3, win 502, options [nop,nop,TS val 3894687906 ecr 2214077234], length 2896
212,23:13:04.891741 IP 172.28.0.10.5000 > 172.28.0.20.42898: Flags [.], ack 279305, win 1564, options [nop,nop,TS val 2214077284 ecr 3894687906], length 0
213,23:13:04.891801 IP 172.28.0.10.5000 > 172.28.0.20.42898: Flags [.], ack 285097, win 1541, options [nop,nop,TS val 2214077284 ecr 3894687906], length 0
214,23:13:04.916847 IP 172.28.0.20.42898 > 172.28.0.10.5000: Flags [P.], seq 287993:290889, ack 3, win 502, options [nop,nop,TS val 3894687957 ecr 2214077284], length 2896
215,23:13:04.916872 IP 172.28.0.20.42898 > 172.28.0.10.5000: Flags [P.], seq 290889:293785, ack 3, win 502, options [nop,nop,TS val 3894687957 ecr 2214077284], length 2896
216,23:13:04.941882 IP 172.28.0.10.5000 > 172.28.0.20.42898: Flags [.], ack 285097, win 1564, options [nop,nop,TS val 2214077335 ecr 3894687906,nop,nop,sack 1 {287993:290889}], length 0
217,23:13:04.941885 IP 172.28.0.10.5000 > 172.28.0.20.42898: Flags [.], ack 285097, win 1564, options [nop,nop,TS val 2214077335 ecr 3894687906,nop,nop,sack 1 {287993:293785}], length 0
218,23:13:04.966974 IP 172.28.0.20.42898 > 172.28.0.10.5000: Flags [P.], seq 293785:296681, ack 3, win 502, options [nop,nop,TS val 3894688007 ecr 2214077335], length 2896
219,23:13:04.966994 IP 172.28.0.20.42898 > 172.28.0.10.5000: Flags [P.], seq 285097:287993, ack 3, win 502, options [nop,nop,TS val 3894688007 ecr 2214077335], length 2896
220,23:13:04.992009 IP 172.28.0.10.5000 > 172.28.0.20.42898: Flags [.], ack 285097, win 1564, options [nop,nop,TS val 2214077385 ecr 3894687906,nop,nop,sack 1 {287993:296681}], length 0
221,23:13:04.992013 IP 172.28.0.10.5000 > 172.28.0.20.42898: Flags [.], ack 296681, win 1507, options [nop,nop,TS val 2214077385 ecr 3894688007], length 0
222,23:13:05.017082 IP 172.28.0.20.42898 > 172.28.0.10.5000: Flags [P.], seq 296681:299577, ack 3, win 502, options [nop,nop,TS val 3894688057 ecr 2214077385], length 2896
223,23:13:05.042116 IP 172.28.0.10.5000 > 172.28.0.20.42898: Flags [.], ack 299577, win 1564, options [nop,nop,TS val 2214077435 ecr 3894688057], length 0
224,23:13:05.067196 IP 172.28.0.20.42898 > 172.28.0.10.5000: Flags [P.], seq 302473:305369, ack 3, win 502, options [nop,nop,TS val 3894688107 ecr 2214077435], length 2896
225,23:13:05.092222 IP 172.28.0.10.5000 > 172.28.0.20.42898: Flags [.], ack 299577, win 1564, options [nop,nop,TS val 2214077485 ecr 3894688057,nop,nop,sack 1 {302473:305369}], length 0
226,23:13:05.117270 IP 172.28.0.20.42898 > 172.28.0.10.5000: Flags [P.], seq 299577:302473, ack 3, win 502, options [nop,nop,TS val 3894688157 ecr 2214077485], length 2896
227,23:13:05.142297 IP 172.28.0.10.5000 > 172.28.0.20.42898: Flags [.], ack 305369, win 1541, options [nop,nop,TS val 2214077535 ecr 3894688157], length 0
228,23:13:05.167378 IP 172.28.0.20.42898 > 172.28.0.10.5000: Flags [.], seq 305369:306817, ack 3, win 502, options [nop,nop,TS val 3894688207 ecr 2214077535], length 1448
229,23:13:05.167395 IP 172.28.0.20.42898 > 172.28.0.10.5000: Flags [.], seq 306817:308265, ack 3, win 502, options [nop,nop,TS val 3894688207 ecr 2214077535], length 1448
230,23:13:05.167405 IP 172.28.0.20.42898 > 172.28.0.10.5000: Flags [.], seq 308265:309713, ack 3, win 502, options [nop,nop,TS val 3894688207 ecr 2214077535], length 1448
231,23:13:05.192416 IP 172.28.0.10.5000 > 172.28.0.20.42898: Flags [.], ack 308265, win 1558, options [nop,nop,TS val 2214077585 ecr 3894688207], length 0
232,23:13:05.217528 IP 172.28.0.20.42898 > 172.28.0.10.5000: Flags [P.], seq 309713:312609, ack 3, win 502, options [nop,nop,TS val 3894688257 ecr 2214077585], length 2896
233,23:13:05.232820 IP 172.28.0.10.5000 > 172.28.0.20.42898: Flags [.], ack 309713, win 1587, options [nop,nop,TS val 2214077626 ecr 3894688207], length 0
234,23:13:05.257928 IP 172.28.0.20.42898 > 172.28.0.10.5000: Flags [P.], seq 312609:315505, ack 3, win 502, options [nop,nop,TS val 3894688298 ecr 2214077626], length 2896
235,23:13:05.282978 IP 172.28.0.10.5000 > 172.28.0.20.42898: Flags [.], ack 315505, win 1587, options [nop,nop,TS val 2214077676 ecr 3894688298], length 0
236,23:13:05.308115 IP 172.28.0.20.42898 > 172.28.0.10.5000: Flags [P.], seq 315505:316953, ack 3, win 502, options [nop,nop,TS val 3894688348 ecr 2214077676], length 1448
237,23:13:05.308141 IP 172.28.0.20.42898 > 172.28.0.10.5000: Flags [P.], seq 316953:319849, ack 3, win 502, options [nop,nop,TS val 3894688348 ecr 2214077676], length 2896
238,23:13:05.308145 IP 172.28.0.20.42898 > 172.28.0.10.5000: Flags [.], seq 319849:321297, ack 3, win 502, options [nop,nop,TS val 3894688348 ecr 2214077676], length 1448
239,23:13:05.333193 IP 172.28.0.10.5000 > 172.28.0.20.42898: Flags [.], ack 321297, win 1550, options [nop,nop,TS val 2214077726 ecr 3894688348], length 0
