1,23:11:17.091714 IP 172.28.0.20.42828 > 172.28.0.10.5000: Flags [S], seq 3068079240, win 64240, options [mss 1460,sackOK,TS val 3894580151 ecr 0,nop,wscale 7], length 0
2,23:11:17.096750 IP 172.28.0.10.5000 > 172.28.0.20.42828: Flags [S.], seq 601991087, ack 3068079241, win 65160, options [mss 1460,sackOK,TS val 2213969509 ecr 3894580151,nop,wscale 7], length 0
3,23:11:17.101815 IP 172.28.0.20.42828 > 172.28.0.10.5000: Flags [.], ack 1, win 502, options [nop,nop,TS val 3894580161 ecr 2213969509], length 0
4,23:11:17.101961 IP 172.28.0.20.42828 > 172.28.0.10.5000: Flags [P.], seq 1:39, ack 1, win 502, options [nop,nop,TS val 3894580162 ecr 2213969509], length 38
5,23:11:17.106980 IP 172.28.0.10.5000 > 172.28.0.20.42828: Flags [.], ack 39, win 509, options [nop,nop,TS val 2213969520 ecr 3894580162], length 0
6,23:11:17.112018 IP 172.28.0.20.42828 > 172.28.0.10.5000: Flags [P.], seq 39:89, ack 1, win 502, options [nop,nop,TS val 3894580172 ecr 2213969520], length 50
7,23:11:17.117041 IP 172.28.0.10.5000 > 172.28.0.20.42828: Flags [.], ack 89, win 509, options [nop,nop,TS val 2213969530 ecr 3894580172], length 0
8,23:11:17.117375 IP 172.28.0.10.5000 > 172.28.0.20.42828: Flags [P.], seq 1:3, ack 89, win 509, options [nop,nop,TS val 2213969530 ecr 3894580172], length 2
9,23:11:17.122408 IP 172.28.0.20.42828 > 172.28.0.10.5000: Flags [.], ack 3, win 502, options [nop,nop,TS val 3894580182 ecr 2213969530], length 0
10,23:11:17.122498 IP 172.28.0.20.42828 > 172.28.0.10.5000: Flags [P.], seq 89:2985, ack 3, win 502, options [nop,nop,TS val 3894580182 ecr 2213969530], length 2896
11,23:11:17.122513 IP 172.28.0.20.42828 > 172.28.0.10.5000: Flags [P.], seq 2985:4185, ack 3, win 502, options [nop,nop,TS val 3894580182 ecr 2213969530], length 1200
12,23:11:17.122535 IP 172.28.0.20.42828 > 172.28.0.10.5000: Flags [P.], seq 4185:7081, ack 3, win 502, options [nop,nop,TS val 3894580182 ecr 2213969530], length 2896
13,23:11:17.122539 IP 172.28.0.20.42828 > 172.28.0.10.5000: Flags [P.], seq 7081:9977, ack 3, win 502, options [nop,nop,TS val 3894580182 ecr 2213969530], length 2896
14,23:11:17.122543 IP 172.28.0.20.42828 > 172.28.0.10.5000: Flags [.], seq 9977:11425, ack 3, win 502, options [nop,nop,TS val 3894580182 ecr 2213969530], length 1448
15,23:11:17.122546 IP 172.28.0.20.42828 > 172.28.0.10.5000: Flags [P.], seq 11425:14321, ack 3, win 502, options [nop,nop,TS val 3894580182 ecr 2213969530], length 2896
16,23:11:17.127520 IP 172.28.0.10.5000 > 172.28.0.20.42828: Flags [.], ack 2985, win 555, options [nop,nop,TS val 2213969540 ecr 3894580182], length 0
17,23:11:17.127557 IP 172.28.0.10.5000 > 172.28.0.20.42828: Flags [.], ack 7081, win 623, options [nop,nop,TS val 2213969540 ecr 3894580182], length 0
18,23:11:17.127558 IP 172.28.0.10.5000 > 172.28.0.20.42828: Flags [.], ack 9977, win 668, options [nop,nop,TS val 2213969540 ecr 3894580182], length 0
19,23:11:17.127559 IP 172.28.0.10.5000 > 172.28.0.20.42828: Flags [.], ack 14321, win 674, options [nop,nop,TS val 2213969540 ecr 3894580182], length 0
20,23:11:17.132589 IP 172.28.0.20.42828 > 172.28.0.10.5000: Flags [P.], seq 14321:17217, ack 3, win 502, options [nop,nop,TS val 3894580192 ecr 2213969540], length 2896
21,23:11:17.132608 IP 172.28.0.20.42828 > 172.28.0.10.5000: Flags [P.], seq 17217:20113, ack 3, win 502, options [nop,nop,TS val 3894580192 ecr 2213969540], length 2896
22,23:11:17.132642 IP 172.28.0.20.42828 > 172.28.0.10.5000: Flags [P.], seq 20113:23009, ack 3, win 502, options [nop,nop,TS val 3894580192 ecr 2213969540], length 2896
23,23:11:17.132646 IP 172.28.0.20.42828 > 172.28.0.10.5000: Flags [P.], seq 23009:25905, ack 3, win 502, options [nop,nop,TS val 3894580192 ecr 2213969540], length 2896
24,23:11:17.132650 IP 172.28.0.20.42828 > 172.28.0.10.5000: Flags [P.], seq 25905:28801, ack 3, win 502, options [nop,nop,TS val 3894580192 ecr 2213969540], length 2896
25,23:11:17.132653 IP 172.28.0.20.42828 > 172.28.0.10.5000: Flags [P.], seq 28801:33145, ack 3, win 502, options [nop,nop,TS val 3894580192 ecr 2213969540], length 4344
26,23:11:17.132657 IP 172.28.0.20.42828 > 172.28.0.10.5000: Flags [P.], seq 33145:37489, ack 3, win 502, options [nop,nop,TS val 3894580192 ecr 2213969540], length 4344
27,23:11:17.132660 IP 172.28.0.20.42828 > 172.28.0.10.5000: Flags [P.], seq 37489:41833, ack 3, win 502, options [nop,nop,TS val 3894580192 ecr 2213969540], length 4344
28,23:11:17.132663 IP 172.28.0.20.42828 > 172.28.0.10.5000: Flags [.], seq 41833:43281, ack 3, win 502, options [nop,nop,TS val 3894580192 ecr 2213969540], length 1448
29,23:11:17.137621 IP 172.28.0.10.5000 > 172.28.0.20.42828: Flags [.], ack 17217, win 719, options [nop,nop,TS val 2213969550 ecr 3894580192], length 0
30,23:11:17.137626 IP 172.28.0.10.5000 > 172.28.0.20.42828: Flags [.], ack 20113, win 723, options [nop,nop,TS val 2213969550 ecr 3894580192], length 0
31,23:11:17.137681 IP 172.28.0.10.5000 > 172.28.0.20.42828: Flags [.], ack 43281, win 571, options [nop,nop,TS val 2213969550 ecr 3894580192], length 0
32,23:11:17.142702 IP 172.28.0.20.42828 > 172.28.0.10.5000: Flags [P.], seq 43281:46177, ack 3, win 502, options [nop,nop,TS val 3894580202 ecr 2213969550], length 2896
33,23:11:17.142722 IP 172.28.0.20.42828 > 172.28.0.10.5000: Flags [P.], seq 46177:51969, ack 3, win 502, options [nop,nop,TS val 3894580202 ecr 2213969550], length 5792
34,23:11:17.142747 IP 172.28.0.20.42828 > 172.28.0.10.5000: Flags [P.], seq 51969:62105, ack 3, win 502, options [nop,nop,TS val 3894580202 ecr 2213969550], length 10136
35,23:11:17.142751 IP 172.28.0.20.42828 > 172.28.0.10.5000: Flags [P.], seq 62105:72241, ack 3, win 502, options [nop,nop,TS val 3894580202 ecr 2213969550], length 10136
36,23:11:17.142755 IP 172.28.0.20.42828 > 172.28.0.10.5000: Flags [P.], seq 72241:78033, ack 3, win 502, options [nop,nop,TS val 3894580202 ecr 2213969550], length 5792
37,23:11:17.142759 IP 172.28.0.20.42828 > 172.28.0.10.5000: Flags [P.], seq 78033:88169, ack 3, win 502, options [nop,nop,TS val 3894580202 ecr 2213969550], length 10136
38,23:11:17.142762 IP 172.28.0.20.42828 > 172.28.0.10.5000: Flags [P.], seq 88169:98305, ack 3, win 502, options [nop,nop,TS val 3894580202 ecr 2213969550], length 10136
39,23:11:17.142766 IP 172.28.0.20.42828 > 172.28.0.10.5000: Flags [P.], seq 98305:101201, ack 3, win 502, options [nop,nop,TS val 3894580202 ecr 2213969550], length 2896
40,23:11:17.147729 IP 172.28.0.10.5000 > 172.28.0.20.42828: Flags [.], ack 46177, win 746, options [nop,nop,TS val 2213969560 ecr 3894580202], length 0
41,23:11:17.148415 IP 172.28.0.10.5000 > 172.28.0.20.42828: Flags [.], ack 101201, win 746, options [nop,nop,TS val 2213969561 ecr 3894580202], length 0
42,23:11:17.152805 IP 172.28.0.20.42828 > 172.28.0.10.5000: Flags [P.], seq 101201:106993, ack 3, win 502, options [nop,nop,TS val 3894580212 ecr 2213969560], length 5792
43,23:11:17.153471 IP 172.28.0.20.42828 > 172.28.0.10.5000: Flags [P.], seq 106993:120025, ack 3, win 502, options [nop,nop,TS val 3894580213 ecr 2213969561], length 13032
44,23:11:17.153504 IP 172.28.0.20.42828 > 172.28.0.10.5000: Flags [P.], seq 120025:141745, ack 3, win 502, options [nop,nop,TS val 3894580213 ecr 2213969561], length 21720
45,23:11:17.153512 IP 172.28.0.20.42828 > 172.28.0.10.5000: Flags [P.], seq 141745:162017, ack 3, win 502, options [nop,nop,TS val 3894580213 ecr 2213969561], length 20272
46,23:11:17.153517 IP 172.28.0.20.42828 > 172.28.0.10.5000: Flags [P.], seq 162017:183737, ack 3, win 502, options [nop,nop,TS val 3894580213 ecr 2213969561], length 21720
47,23:11:17.153522 IP 172.28.0.20.42828 > 172.28.0.10.5000: Flags [P.], seq 183737:196689, ack 3, win 502, options [nop,nop,TS val 3894580213 ecr 2213969561], length 12952
48,23:11:17.157832 IP 172.28.0.10.5000 > 172.28.0.20.42828: Flags [.], ack 106993, win 836, options [nop,nop,TS val 2213969571 ecr 3894580212], length 0
49,23:11:17.158498 IP 172.28.0.10.5000 > 172.28.0.20.42828: Flags [.], ack 120025, win 1040, options [nop,nop,TS val 2213969571 ecr 3894580213], length 0
50,23:11:17.158531 IP 172.28.0.10.5000 > 172.28.0.20.42828: Flags [.], ack 141745, win 1283, options [nop,nop,TS val 2213969571 ecr 3894580213], length 0
51,23:11:17.158920 IP 172.28.0.10.5000 > 172.28.0.20.42828: Flags [.], ack 196689, win 1283, options [nop,nop,TS val 2213969572 ecr 3894580213], length 0
52,23:11:17.162896 IP 172.28.0.20.42828 > 172.28.0.10.5000: Flags [P.], seq 196689:206825, ack 3, win 502, options [nop,nop,TS val 3894580223 ecr 2213969571], length 10136
53,23:11:17.162915 IP 172.28.0.20.42828 > 172.28.0.10.5000: Flags [.], seq 206825:206905, ack 3, win 502, options [nop,nop,TS val 3894580223 ecr 2213969571], length 80
54,23:11:17.163558 IP 172.28.0.20.42828 > 172.28.0.10.5000: Flags [P.], seq 206905:231521, ack 3, win 502, options [nop,nop,TS val 3894580223 ecr 2213969571], length 24616
55,23:11:17.163572 IP 172.28.0.20.42828 > 172.28.0.10.5000: Flags [P.], seq 231521:251793, ack 3, win 502, options [nop,nop,TS val 3894580223 ecr 2213969571], length 20272
56,23:11:17.163595 IP 172.28.0.20.42828 > 172.28.0.10.5000: Flags [P.], seq 251793:280753, ack 3, win 502, options [nop,nop,TS val 3894580223 ecr 2213969571], length 28960
57,23:11:17.163602 IP 172.28.0.20.42828 > 172.28.0.10.5000: Flags [P.], seq 280753:296681, ack 3, win 502, options [nop,nop,TS val 3894580223 ecr 2213969571], length 15928
58,23:11:17.163974 IP 172.28.0.20.42828 > 172.28.0.10.5000: Flags [P.], seq 296681:335777, ack 3, win 502, options [nop,nop,TS val 3894580224 ecr 2213969572], length 39096
59,23:11:17.163984 IP 172.28.0.20.42828 > 172.28.0.10.5000: Flags [P.], seq 335777:341569, ack 3, win 502, options [nop,nop,TS val 3894580224 ecr 2213969572], length 5792
60,23:11:17.163991 IP 172.28.0.20.42828 > 172.28.0.10.5000: Flags [P.], seq 341569:360393, ack 3, win 502, options [nop,nop,TS val 3894580224 ecr 2213969572], length 18824
61,23:11:17.167927 IP 172.28.0.10.5000 > 172.28.0.20.42828: Flags [.], ack 206825, win 1442, options [nop,nop,TS val 2213969581 ecr 3894580223], length 0
62,23:11:17.168591 IP 172.28.0.10.5000 > 172.28.0.20.42828: Flags [.], ack 231521, win 1826, options [nop,nop,TS val 2213969581 ecr 3894580223], length 0
63,23:11:17.168593 IP 172.28.0.10.5000 > 172.28.0.20.42828: Flags [.], ack 251793, win 2143, options [nop,nop,TS val 2213969581 ecr 3894580223], length 0
64,23:11:17.168611 IP 172.28.0.10.5000 > 172.28.0.20.42828: Flags [.], ack 280753, win 2596, options [nop,nop,TS val 2213969581 ecr 3894580223], length 0
65,23:11:17.168613 IP 172.28.0.10.5000 > 172.28.0.20.42828: Flags [.], ack 296681, win 2845, options [nop,nop,TS val 2213969581 ecr 3894580223], length 0
66,23:11:17.168996 IP 172.28.0.10.5000 > 172.28.0.20.42828: Flags [.], ack 335777, win 3455, options [nop,nop,TS val 2213969582 ecr 3894580224], length 0
67,23:11:17.168999 IP 172.28.0.10.5000 > 172.28.0.20.42828: Flags [.], ack 341569, win 3546, options [nop,nop,TS val 2213969582 ecr 3894580224], length 0
68,23:11:17.169318 IP 172.28.0.10.5000 > 172.28.0.20.42828: Flags [.], ack 360393, win 3546, options [nop,nop,TS val 2213969582 ecr 3894580224], length 0
69,23:11:17.173002 IP 172.28.0.20.42828 > 172.28.0.10.5000: Flags [P.], seq 360393:387905, ack 3, win 502, options [nop,nop,TS val 3894580233 ecr 2213969581], length 27512
70,23:11:17.173689 IP 172.28.0.20.42828 > 172.28.0.10.5000: Flags [P.], seq 387905:434241, ack 3, win 502, options [nop,nop,TS val 3894580233 ecr 2213969581], length 46336
71,23:11:17.173707 IP 172.28.0.20.42828 > 172.28.0.10.5000: Flags [P.], seq 434241:480577, ack 3, win 502, options [nop,nop,TS val 3894580233 ecr 2213969581], length 46336
72,23:11:17.173722 IP 172.28.0.20.42828 > 172.28.0.10.5000: Flags [P.], seq 480577:526913, ack 3, win 502, options [nop,nop,TS val 3894580233 ecr 2213969581], length 46336
73,23:11:17.173733 IP 172.28.0.20.42828 > 172.28.0.10.5000: Flags [P.], seq 526913:573249, ack 3, win 502, options [nop,nop,TS val 3894580233 ecr 2213969581], length 46336
74,23:11:17.174050 IP 172.28.0.20.42828 > 172.28.0.10.5000: Flags [P.], seq 573249:619585, ack 3, win 502, options [nop,nop,TS val 3894580234 ecr 2213969582], length 46336
75,23:11:17.174064 IP 172.28.0.20.42828 > 172.28.0.10.5000: Flags [P.], seq 619585:665921, ack 3, win 502, options [nop,nop,TS val 3894580234 ecr 2213969582], length 46336
76,23:11:17.174356 IP 172.28.0.20.42828 > 172.28.0.10.5000: Flags [P.], seq 665921:712257, ack 3, win 502, options [nop,nop,TS val 3894580234 ecr 2213969582], length 46336
77,23:11:17.174368 IP 172.28.0.20.42828 > 172.28.0.10.5000: Flags [P.], seq 712257:736873, ack 3, win 502, options [nop,nop,TS val 3894580234 ecr 2213969582], length 24616
78,23:11:17.178032 IP 172.28.0.10.5000 > 172.28.0.20.42828: Flags [.], ack 387905, win 3976, options [nop,nop,TS val 2213969591 ecr 3894580233], length 0
79,23:11:17.178717 IP 172.28.0.10.5000 > 172.28.0.20.42828: Flags [.], ack 434241, win 4700, options [nop,nop,TS val 2213969591 ecr 3894580233], length 0
80,23:11:17.178720 IP 172.28.0.10.5000 > 172.28.0.20.42828: Flags [.], ack 480577, win 5424, options [nop,nop,TS val 2213969591 ecr 3894580233], length 0
81,23:11:17.178766 IP 172.28.0.10.5000 > 172.28.0.20.42828: Flags [.], ack 526913, win 6148, options [nop,nop,TS val 2213969591 ecr 3894580233], length 0
82,23:11:17.178768 IP 172.28.0.10.5000 > 172.28.0.20.42828: Flags [.], ack 573249, win 6872, options [nop,nop,TS val 2213969591 ecr 3894580233], length 0
83,23:11:17.179073 IP 172.28.0.10.5000 > 172.28.0.20.42828: Flags [.], ack 619585, win 7596, options [nop,nop,TS val 2213969592 ecr 3894580234], length 0
84,23:11:17.179078 IP 172.28.0.10.5000 > 172.28.0.20.42828: Flags [.], ack 665921, win 8320, options [nop,nop,TS val 2213969592 ecr 3894580234], length 0
85,23:11:17.179376 IP 172.28.0.10.5000 > 172.28.0.20.42828: Flags [.], ack 712257, win 9044, options [nop,nop,TS val 2213969592 ecr 3894580234], length 0
86,23:11:17.179379 IP 172.28.0.10.5000 > 172.28.0.20.42828: Flags [.], ack 736873, win 9428, options [nop,nop,TS val 2213969592 ecr 3894580234], length 0
87,23:11:17.183105 IP 172.28.0.20.42828 > 172.28.0.10.5000: Flags [P.], seq 736873:758593, ack 3, win 502, options [nop,nop,TS val 3894580243 ecr 2213969591], length 21720
88,23:11:17.183811 IP 172.28.0.20.42828 > 172.28.0.10.5000: Flags [P.], seq 758593:823753, ack 3, win 502, options [nop,nop,TS val 3894580243 ecr 2213969591], length 65160
89,23:11:17.183828 IP 172.28.0.20.42828 > 172.28.0.10.5000: Flags [P.], seq 823753:888913, ack 3, win 502, options [nop,nop,TS val 3894580243 ecr 2213969591], length 65160
90,23:11:17.183839 IP 172.28.0.20.42828 > 172.28.0.10.5000: Flags [P.], seq 888913:954073, ack 3, win 502, options [nop,nop,TS val 3894580243 ecr 2213969591], length 65160
91,23:11:17.183864 IP 172.28.0.20.42828 > 172.28.0.10.5000: Flags [P.], seq 954073:1019233, ack 3, win 502, options [nop,nop,TS val 3894580244 ecr 2213969591], length 65160
92,23:11:17.183871 IP 172.28.0.20.42828 > 172.28.0.10.5000: Flags [P.], seq 1019233:1048665, ack 3, win 502, options [nop,nop,TS val 3894580244 ecr 2213969591], length 29432
93,23:11:17.188135 IP 172.28.0.10.5000 > 172.28.0.20.42828: Flags [.], ack 758593, win 9768, options [nop,nop,TS val 2213969601 ecr 3894580243], length 0
94,23:11:17.188830 IP 172.28.0.10.5000 > 172.28.0.20.42828: Flags [.], ack 823753, win 10786, options [nop,nop,TS val 2213969602 ecr 3894580243], length 0
95,23:11:17.188859 IP 172.28.0.10.5000 > 172.28.0.20.42828: Flags [.], ack 888913, win 11804, options [nop,nop,TS val 2213969602 ecr 3894580243], length 0
96,23:11:17.188860 IP 172.28.0.10.5000 > 172.28.0.20.42828: Flags [.], ack 954073, win 12684, options [nop,nop,TS val 2213969602 ecr 3894580243], length 0
97,23:11:17.188917 IP 172.28.0.10.5000 > 172.28.0.20.42828: Flags [.], ack 1048665, win 12119, options [nop,nop,TS val 2213969602 ecr 3894580244], length 0
98,23:11:17.190308 IP 172.28.0.10.5000 > 172.28.0.20.42828: Flags [P.], seq 3:103, ack 1048665, win 12684, options [nop,nop,TS val 2213969603 ecr 3894580244], length 100
99,23:11:17.190312 IP 172.28.0.10.5000 > 172.28.0.20.42828: Flags [F.], seq 103, ack 1048665, win 12684, options [nop,nop,TS val 2213969603 ecr 3894580244], length 0
100,23:11:17.195948 IP 172.28.0.20.42828 > 172.28.0.10.5000: Flags [F.], seq 1048665, ack 104, win 502, options [nop,nop,TS val 3894580256 ecr 2213969603], length 0
101,23:11:17.200973 IP 172.28.0.10.5000 > 172.28.0.20.42828: Flags [.], ack 1048666, win 12684, options [nop,nop,TS val 2213969614 ecr 3894580256], length 0
102,23:11:18.197502 IP 172.28.0.20.42838 > 172.28.0.10.5000: Flags [S], seq 3189666496, win 64240, options [mss 1460,sackOK,TS val 3894581257 ecr 0,nop,wscale 7], length 0
103,23:11:18.202547 IP 172.28.0.10.5000 > 172.28.0.20.42838: Flags [S.], seq 295296811, ack 3189666497, win 65160, options [mss 1460,sackOK,TS val 2213970615 ecr 3894581257,nop,wscale 7], length 0
104,23:11:18.207631 IP 172.28.0.20.42838 > 172.28.0.10.5000: Flags [.], ack 1, win 502, options [nop,nop,TS val 3894581267 ecr 2213970615], length 0
105,23:11:18.207841 IP 172.28.0.20.42838 > 172.28.0.10.5000: Flags [P.], seq 1:39, ack 1, win 502, options [nop,nop,TS val 3894581268 ecr 2213970615], length 38
106,23:11:18.212859 IP 172.28.0.10.5000 > 172.28.0.20.42838: Flags [.], ack 39, win 509, options [nop,nop,TS val 2213970626 ecr 3894581268], length 0
107,23:11:18.217910 IP 172.28.0.20.42838 > 172.28.0.10.5000: Flags [P.], seq 39:89, ack 1, win 502, options [nop,nop,TS val 3894581278 ecr 2213970626], length 50
108,23:11:18.222937 IP 172.28.0.10.5000 > 172.28.0.20.42838: Flags [.], ack 89, win 509, options [nop,nop,TS val 2213970636 ecr 3894581278], length 0
109,23:11:18.223203 IP 172.28.0.10.5000 > 172.28.0.20.42838: Flags [P.], seq 1:3, ack 89, win 509, options [nop,nop,TS val 2213970636 ecr 3894581278], length 2
110,23:11:18.228249 IP 172.28.0.20.42838 > 172.28.0.10.5000: Flags [.], ack 3, win 502, options [nop,nop,TS val 3894581288 ecr 2213970636], length 0
111,23:11:18.228349 IP 172.28.0.20.42838 > 172.28.0.10.5000: Flags [P.], seq 89:2985, ack 3, win 502, options [nop,nop,TS val 3894581288 ecr 2213970636], length 2896
112,23:11:18.228366 IP 172.28.0.20.42838 > 172.28.0.10.5000: Flags [P.], seq 2985:4185, ack 3, win 502, options [nop,nop,TS val 3894581288 ecr 2213970636], length 1200
113,23:11:18.228385 IP 172.28.0.20.42838 > 172.28.0.10.5000: Flags [P.], seq 4185:7081, ack 3, win 502, options [nop,nop,TS val 3894581288 ecr 2213970636], length 2896
114,23:11:18.228390 IP 172.28.0.20.42838 > 172.28.0.10.5000: Flags [P.], seq 7081:9977, ack 3, win 502, options [nop,nop,TS val 3894581288 ecr 2213970636], length 2896
115,23:11:18.228395 IP 172.28.0.20.42838 > 172.28.0.10.5000: Flags [.], seq 9977:11425, ack 3, win 502, options [nop,nop,TS val 3894581288 ecr 2213970636], length 1448
116,23:11:18.228398 IP 172.28.0.20.42838 > 172.28.0.10.5000: Flags [P.], seq 11425:14321, ack 3, win 502, options [nop,nop,TS val 3894581288 ecr 2213970636], length 2896
117,23:11:18.233382 IP 172.28.0.10.5000 > 172.28.0.20.42838: Flags [.], ack 2985, win 555, options [nop,nop,TS val 2213970646 ecr 3894581288], length 0
118,23:11:18.233445 IP 172.28.0.10.5000 > 172.28.0.20.42838: Flags [.], ack 7081, win 623, options [nop,nop,TS val 2213970646 ecr 3894581288], length 0
119,23:11:18.233447 IP 172.28.0.10.5000 > 172.28.0.20.42838: Flags [.], ack 9977, win 668, options [nop,nop,TS val 2213970646 ecr 3894581288], length 0
120,23:11:18.233729 IP 172.28.0.10.5000 > 172.28.0.20.42838: Flags [.], ack 14321, win 674, options [nop,nop,TS val 2213970646 ecr 3894581288], length 0
121,23:11:18.238482 IP 172.28.0.20.42838 > 172.28.0.10.5000: Flags [P.], seq 14321:17217, ack 3, win 502, options [nop,nop,TS val 3894581298 ecr 2213970646], length 2896
122,23:11:18.238513 IP 172.28.0.20.42838 > 172.28.0.10.5000: Flags [P.], seq 17217:20113, ack 3, win 502, options [nop,nop,TS val 3894581298 ecr 2213970646], length 2896
123,23:11:18.238533 IP 172.28.0.20.42838 > 172.28.0.10.5000: Flags [P.], seq 20113:23009, ack 3, win 502, options [nop,nop,TS val 3894581298 ecr 2213970646], length 2896
124,23:11:18.238538 IP 172.28.0.20.42838 > 172.28.0.10.5000: Flags [P.], seq 23009:25905, ack 3, win 502, options [nop,nop,TS val 3894581298 ecr 2213970646], length 2896
125,23:11:18.238542 IP 172.28.0.20.42838 > 172.28.0.10.5000: Flags [P.], seq 25905:28801, ack 3, win 502, options [nop,nop,TS val 3894581298 ecr 2213970646], length 2896
126,23:11:18.238546 IP 172.28.0.20.42838 > 172.28.0.10.5000: Flags [P.], seq 28801:33145, ack 3, win 502, options [nop,nop,TS val 3894581298 ecr 2213970646], length 4344
127,23:11:18.238805 IP 172.28.0.20.42838 > 172.28.0.10.5000: Flags [P.], seq 33145:37489, ack 3, win 502, options [nop,nop,TS val 3894581298 ecr 2213970646], length 4344
128,23:11:18.238822 IP 172.28.0.20.42838 > 172.28.0.10.5000: Flags [P.], seq 37489:41833, ack 3, win 502, options [nop,nop,TS val 3894581298 ecr 2213970646], length 4344
129,23:11:18.238826 IP 172.28.0.20.42838 > 172.28.0.10.5000: Flags [.], seq 41833:43281, ack 3, win 502, options [nop,nop,TS val 3894581298 ecr 2213970646], length 1448
130,23:11:18.243520 IP 172.28.0.10.5000 > 172.28.0.20.42838: Flags [.], ack 17217, win 719, options [nop,nop,TS val 2213970656 ecr 3894581298], length 0
131,23:11:18.243529 IP 172.28.0.10.5000 > 172.28.0.20.42838: Flags [.], ack 20113, win 723, options [nop,nop,TS val 2213970656 ecr 3894581298], length 0
132,23:11:18.243575 IP 172.28.0.10.5000 > 172.28.0.20.42838: Flags [.], ack 23009, win 723, options [nop,nop,TS val 2213970656 ecr 3894581298], length 0
133,23:11:18.243588 IP 172.28.0.10.5000 > 172.28.0.20.42838: Flags [.], ack 33145, win 670, options [nop,nop,TS val 2213970656 ecr 3894581298], length 0
134,23:11:18.243829 IP 172.28.0.10.5000 > 172.28.0.20.42838: Flags [.], ack 37489, win 737, options [nop,nop,TS val 2213970657 ecr 3894581298], length 0
135,23:11:18.243864 IP 172.28.0.10.5000 > 172.28.0.20.42838: Flags [.], ack 43281, win 723, options [nop,nop,TS val 2213970657 ecr 3894581298], length 0
136,23:11:18.248608 IP 172.28.0.20.42838 > 172.28.0.10.5000: Flags [P.], seq 43281:46177, ack 3, win 502, options [nop,nop,TS val 3894581308 ecr 2213970656], length 2896
137,23:11:18.248633 IP 172.28.0.20.42838 > 172.28.0.10.5000: Flags [P.], seq 46177:51969, ack 3, win 502, options [nop,nop,TS val 3894581308 ecr 2213970656], length 5792
138,23:11:18.248661 IP 172.28.0.20.42838 > 172.28.0.10.5000: Flags [P.], seq 51969:59209, ack 3, win 502, options [nop,nop,TS val 3894581308 ecr 2213970656], length 7240
139,23:11:18.248665 IP 172.28.0.20.42838 > 172.28.0.10.5000: Flags [P.], seq 59209:67897, ack 3, win 502, options [nop,nop,TS val 3894581308 ecr 2213970656], length 8688
140,23:11:18.248670 IP 172.28.0.20.42838 > 172.28.0.10.5000: Flags [P.], seq 67897:76585, ack 3, win 502, options [nop,nop,TS val 3894581308 ecr 2213970656], length 8688
141,23:11:18.248673 IP 172.28.0.20.42838 > 172.28.0.10.5000: Flags [.], seq 76585:78033, ack 3, win 502, options [nop,nop,TS val 3894581308 ecr 2213970656], length 1448
142,23:11:18.248866 IP 172.28.0.20.42838 > 172.28.0.10.5000: Flags [P.], seq 78033:86721, ack 3, win 502, options [nop,nop,TS val 3894581309 ecr 2213970657], length 8688
143,23:11:18.248891 IP 172.28.0.20.42838 > 172.28.0.10.5000: Flags [P.], seq 86721:96857, ack 3, win 502, options [nop,nop,TS val 3894581309 ecr 2213970657], length 10136
144,23:11:18.248897 IP 172.28.0.20.42838 > 172.28.0.10.5000: Flags [P.], seq 96857:101201, ack 3, win 502, options [nop,nop,TS val 3894581309 ecr 2213970657], length 4344
145,23:11:18.253650 IP 172.28.0.10.5000 > 172.28.0.20.42838: Flags [.], ack 46177, win 746, options [nop,nop,TS val 2213970666 ecr 3894581308], length 0
146,23:11:18.253700 IP 172.28.0.10.5000 > 172.28.0.20.42838: Flags [.], ack 78033, win 746, options [nop,nop,TS val 2213970666 ecr 3894581308], length 0
147,23:11:18.253884 IP 172.28.0.10.5000 > 172.28.0.20.42838: Flags [.], ack 86721, win 882, options [nop,nop,TS val 2213970667 ecr 3894581309], length 0
148,23:11:18.253914 IP 172.28.0.10.5000 > 172.28.0.20.42838: Flags [.], ack 96857, win 1040, options [nop,nop,TS val 2213970667 ecr 3894581309], length 0
149,23:11:18.253915 IP 172.28.0.10.5000 > 172.28.0.20.42838: Flags [.], ack 101201, win 1108, options [nop,nop,TS val 2213970667 ecr 3894581309], length 0
150,23:11:18.258731 IP 172.28.0.20.42838 > 172.28.0.10.5000: Flags [P.], seq 101201:106993, ack 3, win 502, options [nop,nop,TS val 3894581318 ecr 2213970666], length 5792
151,23:11:18.258795 IP 172.28.0.20.42838 > 172.28.0.10.5000: Flags [P.], seq 106993:120025, ack 3, win 502, options [nop,nop,TS val 3894581318 ecr 2213970666], length 13032
152,23:11:18.258803 IP 172.28.0.20.42838 > 172.28.0.10.5000: Flags [P.], seq 120025:137401, ack 3, win 502, options [nop,nop,TS val 3894581318 ecr 2213970666], length 17376
153,23:11:18.258809 IP 172.28.0.20.42838 > 172.28.0.10.5000: Flags [P.], seq 137401:154777, ack 3, win 502, options [nop,nop,TS val 3894581318 ecr 2213970666], length 17376
154,23:11:18.258813 IP 172.28.0.20.42838 > 172.28.0.10.5000: Flags [P.], seq 154777:162017, ack 3, win 502, options [nop,nop,TS val 3894581318 ecr 2213970666], length 7240
155,23:11:18.258933 IP 172.28.0.20.42838 > 172.28.0.10.5000: Flags [P.], seq 162017:180841, ack 3, win 502, options [nop,nop,TS val 3894581319 ecr 2213970667], length 18824
156,23:11:18.258953 IP 172.28.0.20.42838 > 172.28.0.10.5000: Flags [P.], seq 180841:201113, ack 3, win 502, options [nop,nop,TS val 3894581319 ecr 2213970667], length 20272
157,23:11:18.258957 IP 172.28.0.20.42838 > 172.28.0.10.5000: Flags [P.], seq 201113:206905, ack 3, win 502, options [nop,nop,TS val 3894581319 ecr 2213970667], length 5792
158,23:11:18.258961 IP 172.28.0.20.42838 > 172.28.0.10.5000: Flags [P.], seq 206905:217041, ack 3, win 502, options [nop,nop,TS val 3894581319 ecr 2213970667], length 10136
159,23:11:18.263768 IP 172.28.0.10.5000 > 172.28.0.20.42838: Flags [.], ack 106993, win 1198, options [nop,nop,TS val 2213970676 ecr 3894581318], length 0
160,23:11:18.263843 IP 172.28.0.10.5000 > 172.28.0.20.42838: Flags [.], ack 120025, win 1377, options [nop,nop,TS val 2213970677 ecr 3894581318], length 0
161,23:11:18.264043 IP 172.28.0.10.5000 > 172.28.0.20.42838: Flags [.], ack 217041, win 1377, options [nop,nop,TS val 2213970677 ecr 3894581318], length 0
162,23:11:18.268863 IP 172.28.0.20.42838 > 172.28.0.10.5000: Flags [P.], seq 217041:228625, ack 3, win 502, options [nop,nop,TS val 3894581329 ecr 2213970676], length 11584
163,23:11:18.268900 IP 172.28.0.20.42838 > 172.28.0.10.5000: Flags [P.], seq 228625:251793, ack 3, win 502, options [nop,nop,TS val 3894581329 ecr 2213970677], length 23168
164,23:11:18.269119 IP 172.28.0.20.42838 > 172.28.0.10.5000: Flags [P.], seq 251793:295233, ack 3, win 502, options [nop,nop,TS val 3894581329 ecr 2213970677], length 43440
165,23:11:18.269132 IP 172.28.0.20.42838 > 172.28.0.10.5000: Flags [.], seq 295233:296681, ack 3, win 502, options [nop,nop,TS val 3894581329 ecr 2213970677], length 1448
166,23:11:18.269140 IP 172.28.0.20.42838 > 172.28.0.10.5000: Flags [P.], seq 296681:340121, ack 3, win 502, options [nop,nop,TS val 3894581329 ecr 2213970677], length 43440
167,23:11:18.269148 IP 172.28.0.20.42838 > 172.28.0.10.5000: Flags [P.], seq 340121:361841, ack 3, win 502, options [nop,nop,TS val 3894581329 ecr 2213970677], length 21720
168,23:11:18.269154 IP 172.28.0.20.42838 > 172.28.0.10.5000: Flags [P.], seq 361841:393297, ack 3, win 502, options [nop,nop,TS val 3894581329 ecr 2213970677], length 31456
169,23:11:18.273900 IP 172.28.0.10.5000 > 172.28.0.20.42838: Flags [.], ack 228625, win 1558, options [nop,nop,TS val 2213970687 ecr 3894581329], length 0
170,23:11:18.273950 IP 172.28.0.10.5000 > 172.28.0.20.42838: Flags [.], ack 251793, win 1920, options [nop,nop,TS val 2213970687 ecr 3894581329], length 0
171,23:11:18.274138 IP 172.28.0.10.5000 > 172.28.0.20.42838: Flags [.], ack 295233, win 2598, options [nop,nop,TS val 2213970687 ecr 3894581329], length 0
172,23:11:18.274157 IP 172.28.0.10.5000 > 172.28.0.20.42838: Flags [.], ack 340121, win 2872, options [nop,nop,TS val 2213970687 ecr 3894581329], length 0
173,23:11:18.274241 IP 172.28.0.10.5000 > 172.28.0.20.42838: Flags [.], ack 393297, win 2872, options [nop,nop,TS val 2213970687 ecr 3894581329], length 0
174,23:11:18.278971 IP 172.28.0.20.42838 > 172.28.0.10.5000: Flags [P.], seq 393297:426601, ack 3, win 502, options [nop,nop,TS val 3894581339 ecr 2213970687], length 33304
175,23:11:18.278993 IP 172.28.0.20.42838 > 172.28.0.10.5000: Flags [.], seq 426601:427001, ack 3, win 502, options [nop,nop,TS val 3894581339 ecr 2213970687], length 400
176,23:11:18.279013 IP 172.28.0.20.42838 > 172.28.0.10.5000: Flags [P.], seq 427001:477681, ack 3, win 502, options [nop,nop,TS val 3894581339 ecr 2213970687], length 50680
177,23:11:18.279019 IP 172.28.0.20.42838 > 172.28.0.10.5000: Flags [P.], seq 477681:492161, ack 3, win 502, options [nop,nop,TS val 3894581339 ecr 2213970687], length 14480
178,23:11:18.279201 IP 172.28.0.20.42838 > 172.28.0.10.5000: Flags [P.], seq 492161:551529, ack 3, win 502, options [nop,nop,TS val 3894581339 ecr 2213970687], length 59368
179,23:11:18.279209 IP 172.28.0.20.42838 > 172.28.0.10.5000: Flags [P.], seq 551529:557321, ack 3, win 502, options [nop,nop,TS val 3894581339 ecr 2213970687], length 5792
180,23:11:18.279220 IP 172.28.0.20.42838 > 172.28.0.10.5000: Flags [P.], seq 557321:622481, ack 3, win 502, options [nop,nop,TS val 3894581339 ecr 2213970687], length 65160
181,23:11:18.279232 IP 172.28.0.20.42838 > 172.28.0.10.5000: Flags [P.], seq 622481:687641, ack 3, win 502, options [nop,nop,TS val 3894581339 ecr 2213970687], length 65160
182,23:11:18.279275 IP 172.28.0.20.42838 > 172.28.0.10.5000: Flags [P.], seq 687641:752801, ack 3, win 502, options [nop,nop,TS val 3894581339 ecr 2213970687], length 65160
183,23:11:18.279283 IP 172.28.0.20.42838 > 172.28.0.10.5000: Flags [P.], seq 752801:760041, ack 3, win 502, options [nop,nop,TS val 3894581339 ecr 2213970687], length 7240
184,23:11:18.284000 IP 172.28.0.10.5000 > 172.28.0.20.42838: Flags [.], ack 426601, win 3392, options [nop,nop,TS val 2213970697 ecr 3894581339], length 0
185,23:11:18.284045 IP 172.28.0.10.5000 > 172.28.0.20.42838: Flags [.], ack 477681, win 4207, options [nop,nop,TS val 2213970697 ecr 3894581339], length 0
186,23:11:18.284046 IP 172.28.0.10.5000 > 172.28.0.20.42838: Flags [.], ack 492161, win 4433, options [nop,nop,TS val 2213970697 ecr 3894581339], length 0
187,23:11:18.284219 IP 172.28.0.10.5000 > 172.28.0.20.42838: Flags [.], ack 551529, win 5361, options [nop,nop,TS val 2213970697 ecr 3894581339], length 0
188,23:11:18.284221 IP 172.28.0.10.5000 > 172.28.0.20.42838: Flags [.], ack 557321, win 5451, options [nop,nop,TS val 2213970697 ecr 3894581339], length 0
189,23:11:18.284248 IP 172.28.0.10.5000 > 172.28.0.20.42838: Flags [.], ack 622481, win 6469, options [nop,nop,TS val 2213970697 ecr 3894581339], length 0
190,23:11:18.284249 IP 172.28.0.10.5000 > 172.28.0.20.42838: Flags [.], ack 687641, win 7487, options [nop,nop,TS val 2213970697 ecr 3894581339], length 0
191,23:11:18.284412 IP 172.28.0.10.5000 > 172.28.0.20.42838: Flags [.], ack 752801, win 8505, options [nop,nop,TS val 2213970697 ecr 3894581339], length 0
192,23:11:18.284413 IP 172.28.0.10.5000 > 172.28.0.20.42838: Flags [.], ack 760041, win 8619, options [nop,nop,TS val 2213970697 ecr 3894581339], length 0
193,23:11:18.289071 IP 172.28.0.20.42838 > 172.28.0.10.5000: Flags [P.], seq 760041:817961, ack 3, win 502, options [nop,nop,TS val 3894581349 ecr 2213970697], length 57920
194,23:11:18.289113 IP 172.28.0.20.42838 > 172.28.0.10.5000: Flags [P.], seq 817961:883121, ack 3, win 502, options [nop,nop,TS val 3894581349 ecr 2213970697], length 65160
195,23:11:18.289124 IP 172.28.0.20.42838 > 172.28.0.10.5000: Flags [P.], seq 883121:948281, ack 3, win 502, options [nop,nop,TS val 3894581349 ecr 2213970697], length 65160
196,23:11:18.289270 IP 172.28.0.20.42838 > 172.28.0.10.5000: Flags [P.], seq 948281:1013441, ack 3, win 502, options [nop,nop,TS val 3894581349 ecr 2213970697], length 65160
197,23:11:18.289277 IP 172.28.0.20.42838 > 172.28.0.10.5000: Flags [P.], seq 1013441:1048665, ack 3, win 502, options [nop,nop,TS val 3894581349 ecr 2213970697], length 35224
198,23:11:18.294104 IP 172.28.0.10.5000 > 172.28.0.20.42838: Flags [.], ack 817961, win 9524, options [nop,nop,TS val 2213970707 ecr 3894581349], length 0
199,23:11:18.294141 IP 172.28.0.10.5000 > 172.28.0.20.42838: Flags [.], ack 883121, win 9643, options [nop,nop,TS val 2213970707 ecr 3894581349], length 0
200,23:11:18.294173 IP 172.28.0.10.5000 > 172.28.0.20.42838: Flags [.], ack 948281, win 9256, options [nop,nop,TS val 2213970707 ecr 3894581349], length 0
201,23:11:18.294289 IP 172.28.0.10.5000 > 172.28.0.20.42838: Flags [.], ack 1013441, win 8747, options [nop,nop,TS val 2213970707 ecr 3894581349], length 0
202,23:11:18.294301 IP 172.28.0.10.5000 > 172.28.0.20.42838: Flags [.], ack 1048665, win 8657, options [nop,nop,TS val 2213970707 ecr 3894581349], length 0
203,23:11:18.295502 IP 172.28.0.10.5000 > 172.28.0.20.42838: Flags [P.], seq 3:103, ack 1048665, win 9643, options [nop,nop,TS val 2213970708 ecr 3894581349], length 100
204,23:11:18.295525 IP 172.28.0.10.5000 > 172.28.0.20.42838: Flags [F.], seq 103, ack 1048665, win 9643, options [nop,nop,TS val 2213970708 ecr 3894581349], length 0
205,23:11:18.300584 IP 172.28.0.20.42838 > 172.28.0.10.5000: Flags [F.], seq 1048665, ack 104, win 502, options [nop,nop,TS val 3894581360 ecr 2213970708], length 0
206,23:11:18.305613 IP 172.28.0.10.5000 > 172.28.0.20.42838: Flags [.], ack 1048666, win 9643, options [nop,nop,TS val 2213970718 ecr 3894581360], length 0
207,23:11:19.301542 IP 172.28.0.20.42850 > 172.28.0.10.5000: Flags [S], seq 511131528, win 64240, options [mss 1460,sackOK,TS val 3894582361 ecr 0,nop,wscale 7], length 0
208,23:11:19.306583 IP 172.28.0.10.5000 > 172.28.0.20.42850: Flags [S.], seq 756506714, ack 511131529, win 65160, options [mss 1460,sackOK,TS val 2213971719 ecr 3894582361,nop,wscale 7], length 0
209,23:11:19.311638 IP 172.28.0.20.42850 > 172.28.0.10.5000: Flags [.], ack 1, win 502, options [nop,nop,TS val 3894582371 ecr 2213971719], length 0
210,23:11:19.311767 IP 172.28.0.20.42850 > 172.28.0.10.5000: Flags [P.], seq 1:39, ack 1, win 502, options [nop,nop,TS val 3894582371 ecr 2213971719], length 38
211,23:11:19.316799 IP 172.28.0.10.5000 > 172.28.0.20.42850: Flags [.], ack 39, win 509, options [nop,nop,TS val 2213971729 ecr 3894582371], length 0
212,23:11:19.321843 IP 172.28.0.20.42850 > 172.28.0.10.5000: Flags [P.], seq 39:89, ack 1, win 502, options [nop,nop,TS val 3894582382 ecr 2213971729], length 50
213,23:11:19.326869 IP 172.28.0.10.5000 > 172.28.0.20.42850: Flags [.], ack 89, win 509, options [nop,nop,TS val 2213971740 ecr 3894582382], length 0
214,23:11:19.327080 IP 172.28.0.10.5000 > 172.28.0.20.42850: Flags [P.], seq 1:3, ack 89, win 509, options [nop,nop,TS val 2213971740 ecr 3894582382], length 2
215,23:11:19.332113 IP 172.28.0.20.42850 > 172.28.0.10.5000: Flags [.], ack 3, win 502, options [nop,nop,TS val 3894582392 ecr 2213971740], length 0
216,23:11:19.332182 IP 172.28.0.20.42850 > 172.28.0.10.5000: Flags [P.], seq 89:2985, ack 3, win 502, options [nop,nop,TS val 3894582392 ecr 2213971740], length 2896
217,23:11:19.332197 IP 172.28.0.20.42850 > 172.28.0.10.5000: Flags [P.], seq 2985:4185, ack 3, win 502, options [nop,nop,TS val 3894582392 ecr 2213971740], length 1200
218,23:11:19.332218 IP 172.28.0.20.42850 > 172.28.0.10.5000: Flags [P.], seq 4185:7081, ack 3, win 502, options [nop,nop,TS val 3894582392 ecr 2213971740], length 2896
219,23:11:19.332228 IP 172.28.0.20.42850 > 172.28.0.10.5000: Flags [P.], seq 7081:9977, ack 3, win 502, options [nop,nop,TS val 3894582392 ecr 2213971740], length 2896
220,23:11:19.332234 IP 172.28.0.20.42850 > 172.28.0.10.5000: Flags [.], seq 9977:11425, ack 3, win 502, options [nop,nop,TS val 3894582392 ecr 2213971740], length 1448
221,23:11:19.332236 IP 172.28.0.20.42850 > 172.28.0.10.5000: Flags [P.], seq 11425:14321, ack 3, win 502, options [nop,nop,TS val 3894582392 ecr 2213971740], length 2896
222,23:11:19.337204 IP 172.28.0.10.5000 > 172.28.0.20.42850: Flags [.], ack 2985, win 555, options [nop,nop,TS val 2213971750 ecr 3894582392], length 0
223,23:11:19.337236 IP 172.28.0.10.5000 > 172.28.0.20.42850: Flags [.], ack 7081, win 623, options [nop,nop,TS val 2213971750 ecr 3894582392], length 0
224,23:11:19.337237 IP 172.28.0.10.5000 > 172.28.0.20.42850: Flags [.], ack 9977, win 668, options [nop,nop,TS val 2213971750 ecr 3894582392], length 0
225,23:11:19.337263 IP 172.28.0.10.5000 > 172.28.0.20.42850: Flags [.], ack 14321, win 709, options [nop,nop,TS val 2213971750 ecr 3894582392], length 0
226,23:11:19.342251 IP 172.28.0.20.42850 > 172.28.0.10.5000: Flags [P.], seq 14321:17217, ack 3, win 502, options [nop,nop,TS val 3894582402 ecr 2213971750], length 2896
227,23:11:19.342272 IP 172.28.0.20.42850 > 172.28.0.10.5000: Flags [P.], seq 17217:20113, ack 3, win 502, options [nop,nop,TS val 3894582402 ecr 2213971750], length 2896
228,23:11:19.342307 IP 172.28.0.20.42850 > 172.28.0.10.5000: Flags [P.], seq 20113:23009, ack 3, win 502, options [nop,nop,TS val 3894582402 ecr 2213971750], length 2896
229,23:11:19.342310 IP 172.28.0.20.42850 > 172.28.0.10.5000: Flags [P.], seq 23009:25905, ack 3, win 502, options [nop,nop,TS val 3894582402 ecr 2213971750], length 2896
230,23:11:19.342313 IP 172.28.0.20.42850 > 172.28.0.10.5000: Flags [P.], seq 25905:28801, ack 3, win 502, options [nop,nop,TS val 3894582402 ecr 2213971750], length 2896
231,23:11:19.342317 IP 172.28.0.20.42850 > 172.28.0.10.5000: Flags [P.], seq 28801:33145, ack 3, win 502, options [nop,nop,TS val 3894582402 ecr 2213971750], length 4344
232,23:11:19.342320 IP 172.28.0.20.42850 > 172.28.0.10.5000: Flags [P.], seq 33145:37489, ack 3, win 502, options [nop,nop,TS val 3894582402 ecr 2213971750], length 4344
233,23:11:19.342322 IP 172.28.0.20.42850 > 172.28.0.10.5000: Flags [P.], seq 37489:41833, ack 3, win 502, options [nop,nop,TS val 3894582402 ecr 2213971750], length 4344
234,23:11:19.342325 IP 172.28.0.20.42850 > 172.28.0.10.5000: Flags [.], seq 41833:43281, ack 3, win 502, options [nop,nop,TS val 3894582402 ecr 2213971750], length 1448
235,23:11:19.347278 IP 172.28.0.10.5000 > 172.28.0.20.42850: Flags [.], ack 17217, win 746, options [nop,nop,TS val 2213971760 ecr 3894582402], length 0
236,23:11:19.347308 IP 172.28.0.10.5000 > 172.28.0.20.42850: Flags [.], ack 20113, win 746, options [nop,nop,TS val 2213971760 ecr 3894582402], length 0
237,23:11:19.347327 IP 172.28.0.10.5000 > 172.28.0.20.42850: Flags [.], ack 28801, win 679, options [nop,nop,TS val 2213971760 ecr 3894582402], length 0
238,23:11:19.347344 IP 172.28.0.10.5000 > 172.28.0.20.42850: Flags [.], ack 43281, win 639, options [nop,nop,TS val 2213971760 ecr 3894582402], length 0
239,23:11:19.352325 IP 172.28.0.20.42850 > 172.28.0.10.5000: Flags [P.], seq 43281:46177, ack 3, win 502, options [nop,nop,TS val 3894582412 ecr 2213971760], length 2896
240,23:11:19.352361 IP 172.28.0.20.42850 > 172.28.0.10.5000: Flags [P.], seq 46177:51969, ack 3, win 502, options [nop,nop,TS val 3894582412 ecr 2213971760], length 5792
241,23:11:19.352367 IP 172.28.0.20.42850 > 172.28.0.10.5000: Flags [P.], seq 51969:59209, ack 3, win 502, options [nop,nop,TS val 3894582412 ecr 2213971760], length 7240
242,23:11:19.352374 IP 172.28.0.20.42850 > 172.28.0.10.5000: Flags [P.], seq 59209:66449, ack 3, win 502, options [nop,nop,TS val 3894582412 ecr 2213971760], length 7240
243,23:11:19.352398 IP 172.28.0.20.42850 > 172.28.0.10.5000: Flags [P.], seq 66449:76585, ack 3, win 502, options [nop,nop,TS val 3894582412 ecr 2213971760], length 10136
244,23:11:19.352403 IP 172.28.0.20.42850 > 172.28.0.10.5000: Flags [.], seq 76585:78033, ack 3, win 502, options [nop,nop,TS val 3894582412 ecr 2213971760], length 1448
