1,00:25:49.255166 IP 172.28.0.20.59488 > 172.28.0.10.5000: Flags [S], seq 2025705542, win 64240, options [mss 1460,sackOK,TS val 2753936619 ecr 0,nop,wscale 7], length 0
2,00:25:49.280202 IP 172.28.0.10.5000 > 172.28.0.20.59488: Flags [S.], seq 2697108826, ack 2025705543, win 65160, options [mss 1460,sackOK,TS val 3502798269 ecr 2753936619,nop,wscale 7], length 0
3,00:25:49.305277 IP 172.28.0.20.59488 > 172.28.0.10.5000: Flags [.], ack 1, win 502, options [nop,nop,TS val 2753936720 ecr 3502798269], length 0
4,00:25:49.305471 IP 172.28.0.20.59488 > 172.28.0.10.5000: Flags [P.], seq 1:39, ack 1, win 502, options [nop,nop,TS val 2753936720 ecr 3502798269], length 38
5,00:25:49.330491 IP 172.28.0.10.5000 > 172.28.0.20.59488: Flags [.], ack 39, win 509, options [nop,nop,TS val 3502798319 ecr 2753936720], length 0
6,00:25:49.355550 IP 172.28.0.20.59488 > 172.28.0.10.5000: Flags [P.], seq 39:89, ack 1, win 502, options [nop,nop,TS val 2753936770 ecr 3502798319], length 50
7,00:25:49.380606 IP 172.28.0.10.5000 > 172.28.0.20.59488: Flags [.], ack 89, win 509, options [nop,nop,TS val 3502798369 ecr 2753936770], length 0
8,00:25:49.381103 IP 172.28.0.10.5000 > 172.28.0.20.59488: Flags [P.], seq 1:3, ack 89, win 509, options [nop,nop,TS val 3502798369 ecr 2753936770], length 2
9,00:25:49.406168 IP 172.28.0.20.59488 > 172.28.0.10.5000: Flags [.], ack 3, win 502, options [nop,nop,TS val 2753936821 ecr 3502798369], length 0
10,00:25:49.406266 IP 172.28.0.20.59488 > 172.28.0.10.5000: Flags [P.], seq 89:2985, ack 3, win 502, options [nop,nop,TS val 2753936821 ecr 3502798369], length 2896
11,00:25:49.406314 IP 172.28.0.20.59488 > 172.28.0.10.5000: Flags [P.], seq 4185:7081, ack 3, win 502, options [nop,nop,TS val 2753936821 ecr 3502798369], length 2896
12,00:25:49.406322 IP 172.28.0.20.59488 > 172.28.0.10.5000: Flags [P.], seq 7081:9977, ack 3, win 502, options [nop,nop,TS val 2753936821 ecr 3502798369], length 2896
13,00:25:49.406328 IP 172.28.0.20.59488 > 172.28.0.10.5000: Flags [.], seq 9977:11425, ack 3, win 502, options [nop,nop,TS val 2753936821 ecr 3502798369], length 1448
14,00:25:49.406333 IP 172.28.0.20.59488 > 172.28.0.10.5000: Flags [P.], seq 11425:14321, ack 3, win 502, options [nop,nop,TS val 2753936821 ecr 3502798369], length 2896
15,00:25:49.431339 IP 172.28.0.10.5000 > 172.28.0.20.59488: Flags [.], ack 2985, win 600, options [nop,nop,TS val 3502798420 ecr 2753936821,nop,nop,sack 1 {4185:7081}], length 0
16,00:25:49.431344 IP 172.28.0.10.5000 > 172.28.0.20.59488: Flags [.], ack 2985, win 645, options [nop,nop,TS val 3502798420 ecr 2753936821,nop,nop,sack 1 {4185:9977}], length 0
17,00:25:49.431347 IP 172.28.0.10.5000 > 172.28.0.20.59488: Flags [.], ack 2985, win 668, options [nop,nop,TS val 3502798420 ecr 2753936821,nop,nop,sack 1 {4185:11425}], length 0
18,00:25:49.431451 IP 172.28.0.10.5000 > 172.28.0.20.59488: Flags [.], ack 2985, win 687, options [nop,nop,TS val 3502798420 ecr 2753936821,nop,nop,sack 1 {4185:14321}], length 0
19,00:25:49.456430 IP 172.28.0.20.59488 > 172.28.0.10.5000: Flags [P.], seq 14321:17217, ack 3, win 502, options [nop,nop,TS val 2753936871 ecr 3502798420], length 2896
20,00:25:49.456438 IP 172.28.0.20.59488 > 172.28.0.10.5000: Flags [P.], seq 17217:20113, ack 3, win 502, options [nop,nop,TS val 2753936871 ecr 3502798420], length 2896
21,00:25:49.456441 IP 172.28.0.20.59488 > 172.28.0.10.5000: Flags [P.], seq 23009:25905, ack 3, win 502, options [nop,nop,TS val 2753936871 ecr 3502798420], length 2896
22,00:25:49.456443 IP 172.28.0.20.59488 > 172.28.0.10.5000: Flags [P.], seq 2985:4185, ack 3, win 502, options [nop,nop,TS val 2753936871 ecr 3502798420], length 1200
23,00:25:49.456456 IP 172.28.0.20.59488 > 172.28.0.10.5000: Flags [.], seq 25905:27353, ack 3, win 502, options [nop,nop,TS val 2753936871 ecr 3502798420], length 1448
24,00:25:49.456485 IP 172.28.0.20.59488 > 172.28.0.10.5000: Flags [P.], seq 27353:30249, ack 3, win 502, options [nop,nop,TS val 2753936871 ecr 3502798420], length 2896
25,00:25:49.481487 IP 172.28.0.10.5000 > 172.28.0.20.59488: Flags [.], ack 20113, win 634, options [nop,nop,TS val 3502798470 ecr 2753936871,nop,nop,sack 1 {23009:25905}], length 0
26,00:25:49.481490 IP 172.28.0.10.5000 > 172.28.0.20.59488: Flags [.], ack 20113, win 634, options [nop,nop,TS val 3502798470 ecr 2753936871,nop,nop,sack 1 {23009:27353}], length 0
27,00:25:49.481545 IP 172.28.0.10.5000 > 172.28.0.20.59488: Flags [.], ack 20113, win 634, options [nop,nop,TS val 3502798470 ecr 2753936871,nop,nop,sack 1 {23009:30249}], length 0
28,00:25:49.506588 IP 172.28.0.20.59488 > 172.28.0.10.5000: Flags [P.], seq 20113:23009, ack 3, win 502, options [nop,nop,TS val 2753936921 ecr 3502798470], length 2896
29,00:25:49.506613 IP 172.28.0.20.59488 > 172.28.0.10.5000: Flags [P.], seq 30249:33145, ack 3, win 502, options [nop,nop,TS val 2753936921 ecr 3502798470], length 2896
30,00:25:49.506618 IP 172.28.0.20.59488 > 172.28.0.10.5000: Flags [P.], seq 33145:36041, ack 3, win 502, options [nop,nop,TS val 2753936921 ecr 3502798470], length 2896
31,00:25:49.506621 IP 172.28.0.20.59488 > 172.28.0.10.5000: Flags [.], seq 36041:37489, ack 3, win 502, options [nop,nop,TS val 2753936921 ecr 3502798470], length 1448
32,00:25:49.506623 IP 172.28.0.20.59488 > 172.28.0.10.5000: Flags [P.], seq 37489:40385, ack 3, win 502, options [nop,nop,TS val 2753936921 ecr 3502798470], length 2896
33,00:25:49.531625 IP 172.28.0.10.5000 > 172.28.0.20.59488: Flags [.], ack 30249, win 687, options [nop,nop,TS val 3502798520 ecr 2753936921], length 0
34,00:25:49.531664 IP 172.28.0.10.5000 > 172.28.0.20.59488: Flags [.], ack 40385, win 661, options [nop,nop,TS val 3502798520 ecr 2753936921], length 0
35,00:25:49.556720 IP 172.28.0.20.59488 > 172.28.0.10.5000: Flags [P.], seq 40385:43281, ack 3, win 502, options [nop,nop,TS val 2753936971 ecr 3502798520], length 2896
36,00:25:49.556743 IP 172.28.0.20.59488 > 172.28.0.10.5000: Flags [P.], seq 43281:46177, ack 3, win 502, options [nop,nop,TS val 2753936971 ecr 3502798520], length 2896
37,00:25:49.556748 IP 172.28.0.20.59488 > 172.28.0.10.5000: Flags [P.], seq 46177:49073, ack 3, win 502, options [nop,nop,TS val 2753936971 ecr 3502798520], length 2896
38,00:25:49.556751 IP 172.28.0.20.59488 > 172.28.0.10.5000: Flags [P.], seq 51969:54865, ack 3, win 502, options [nop,nop,TS val 2753936971 ecr 3502798520], length 2896
39,00:25:49.581775 IP 172.28.0.10.5000 > 172.28.0.20.59488: Flags [.], ack 43281, win 732, options [nop,nop,TS val 3502798570 ecr 2753936971], length 0
40,00:25:49.581778 IP 172.28.0.10.5000 > 172.28.0.20.59488: Flags [.], ack 49073, win 687, options [nop,nop,TS val 3502798570 ecr 2753936971,nop,nop,sack 1 {51969:54865}], length 0
41,00:25:49.606872 IP 172.28.0.20.59488 > 172.28.0.10.5000: Flags [P.], seq 54865:57761, ack 3, win 502, options [nop,nop,TS val 2753937021 ecr 3502798570], length 2896
42,00:25:49.606888 IP 172.28.0.20.59488 > 172.28.0.10.5000: Flags [P.], seq 57761:60657, ack 3, win 502, options [nop,nop,TS val 2753937021 ecr 3502798570], length 2896
43,00:25:49.606892 IP 172.28.0.20.59488 > 172.28.0.10.5000: Flags [P.], seq 60657:63553, ack 3, win 502, options [nop,nop,TS val 2753937021 ecr 3502798570], length 2896
44,00:25:49.606897 IP 172.28.0.20.59488 > 172.28.0.10.5000: Flags [P.], seq 63553:66449, ack 3, win 502, options [nop,nop,TS val 2753937021 ecr 3502798570], length 2896
45,00:25:49.622178 IP 172.28.0.20.59488 > 172.28.0.10.5000: Flags [.], seq 49073:50521, ack 3, win 502, options [nop,nop,TS val 2753937037 ecr 3502798570], length 1448
46,00:25:49.631920 IP 172.28.0.10.5000 > 172.28.0.20.59488: Flags [.], ack 49073, win 723, options [nop,nop,TS val 3502798620 ecr 2753936971,nop,nop,sack 1 {51969:57761}], length 0
47,00:25:49.631924 IP 172.28.0.10.5000 > 172.28.0.20.59488: Flags [.], ack 49073, win 723, options [nop,nop,TS val 3502798620 ecr 2753936971,nop,nop,sack 1 {51969:60657}], length 0
48,00:25:49.633060 IP 172.28.0.10.5000 > 172.28.0.20.59488: Flags [.], ack 49073, win 723, options [nop,nop,TS val 3502798620 ecr 2753936971,nop,nop,sack 1 {51969:66449}], length 0
49,00:25:49.647223 IP 172.28.0.10.5000 > 172.28.0.20.59488: Flags [.], ack 50521, win 712, options [nop,nop,TS val 3502798636 ecr 2753937037,nop,nop,sack 1 {51969:66449}], length 0
50,00:25:49.657013 IP 172.28.0.20.59488 > 172.28.0.10.5000: Flags [.], seq 50521:51969, ack 3, win 502, options [nop,nop,TS val 2753937071 ecr 3502798620], length 1448
51,00:25:49.657035 IP 172.28.0.20.59488 > 172.28.0.10.5000: Flags [.], seq 66449:67897, ack 3, win 502, options [nop,nop,TS val 2753937071 ecr 3502798620], length 1448
52,00:25:49.658132 IP 172.28.0.20.59488 > 172.28.0.10.5000: Flags [P.], seq 67897:70793, ack 3, win 502, options [nop,nop,TS val 2753937072 ecr 3502798620], length 2896
53,00:25:49.658147 IP 172.28.0.20.59488 > 172.28.0.10.5000: Flags [P.], seq 70793:73689, ack 3, win 502, options [nop,nop,TS val 2753937072 ecr 3502798620], length 2896
54,00:25:49.672318 IP 172.28.0.20.59488 > 172.28.0.10.5000: Flags [.], seq 73689:75137, ack 3, win 502, options [nop,nop,TS val 2753937087 ecr 3502798636], length 1448
55,00:25:49.682067 IP 172.28.0.10.5000 > 172.28.0.20.59488: Flags [.], ack 66449, win 664, options [nop,nop,TS val 3502798670 ecr 2753937071], length 0
56,00:25:49.683174 IP 172.28.0.10.5000 > 172.28.0.20.59488: Flags [.], ack 70793, win 746, options [nop,nop,TS val 3502798672 ecr 2753937071], length 0
57,00:25:49.683176 IP 172.28.0.10.5000 > 172.28.0.20.59488: Flags [.], ack 73689, win 746, options [nop,nop,TS val 3502798672 ecr 2753937072], length 0
58,00:25:49.707139 IP 172.28.0.20.59488 > 172.28.0.10.5000: Flags [.], seq 75137:76585, ack 3, win 502, options [nop,nop,TS val 2753937122 ecr 3502798670], length 1448
59,00:25:49.708222 IP 172.28.0.20.59488 > 172.28.0.10.5000: Flags [P.], seq 78033:80929, ack 3, win 502, options [nop,nop,TS val 2753937123 ecr 3502798672], length 2896
60,00:25:49.708228 IP 172.28.0.20.59488 > 172.28.0.10.5000: Flags [P.], seq 80929:83825, ack 3, win 502, options [nop,nop,TS val 2753937123 ecr 3502798672], length 2896
61,00:25:49.732196 IP 172.28.0.10.5000 > 172.28.0.20.59488: Flags [.], ack 76585, win 777, options [nop,nop,TS val 3502798721 ecr 2753937087], length 0
62,00:25:49.733255 IP 172.28.0.10.5000 > 172.28.0.20.59488: Flags [.], ack 76585, win 822, options [nop,nop,TS val 3502798722 ecr 2753937087,nop,nop,sack 1 {78033:80929}], length 0
63,00:25:49.733258 IP 172.28.0.10.5000 > 172.28.0.20.59488: Flags [.], ack 76585, win 868, options [nop,nop,TS val 3502798722 ecr 2753937087,nop,nop,sack 1 {78033:83825}], length 0
64,00:25:49.757286 IP 172.28.0.20.59488 > 172.28.0.10.5000: Flags [P.], seq 83825:86721, ack 3, win 502, options [nop,nop,TS val 2753937172 ecr 3502798721], length 2896
65,00:25:49.757304 IP 172.28.0.20.59488 > 172.28.0.10.5000: Flags [.], seq 86721:88169, ack 3, win 502, options [nop,nop,TS val 2753937172 ecr 3502798721], length 1448
66,00:25:49.758324 IP 172.28.0.20.59488 > 172.28.0.10.5000: Flags [P.], seq 88169:91065, ack 3, win 502, options [nop,nop,TS val 2753937173 ecr 3502798722], length 2896
67,00:25:49.758329 IP 172.28.0.20.59488 > 172.28.0.10.5000: Flags [.], seq 76585:78033, ack 3, win 502, options [nop,nop,TS val 2753937173 ecr 3502798722], length 1448
68,00:25:49.782314 IP 172.28.0.10.5000 > 172.28.0.20.59488: Flags [.], ack 76585, win 913, options [nop,nop,TS val 3502798771 ecr 2753937087,nop,nop,sack 1 {78033:86721}], length 0
69,00:25:49.783356 IP 172.28.0.10.5000 > 172.28.0.20.59488: Flags [.], ack 91065, win 1003, options [nop,nop,TS val 3502798772 ecr 2753937173], length 0
70,00:25:49.807414 IP 172.28.0.20.59488 > 172.28.0.10.5000: Flags [.], seq 91065:92513, ack 3, win 502, options [nop,nop,TS val 2753937222 ecr 3502798771], length 1448
71,00:25:49.808412 IP 172.28.0.20.59488 > 172.28.0.10.5000: Flags [P.], seq 92513:95409, ack 3, win 502, options [nop,nop,TS val 2753937223 ecr 3502798772], length 2896
72,00:25:49.808433 IP 172.28.0.20.59488 > 172.28.0.10.5000: Flags [P.], seq 95409:98305, ack 3, win 502, options [nop,nop,TS val 2753937223 ecr 3502798772], length 2896
73,00:25:49.833464 IP 172.28.0.10.5000 > 172.28.0.20.59488: Flags [.], ack 95409, win 1071, options [nop,nop,TS val 3502798822 ecr 2753937222], length 0
74,00:25:49.833469 IP 172.28.0.10.5000 > 172.28.0.20.59488: Flags [.], ack 98305, win 1116, options [nop,nop,TS val 3502798822 ecr 2753937223], length 0
75,00:25:49.858542 IP 172.28.0.20.59488 > 172.28.0.10.5000: Flags [P.], seq 98305:101201, ack 3, win 502, options [nop,nop,TS val 2753937273 ecr 3502798822], length 2896
76,00:25:49.858569 IP 172.28.0.20.59488 > 172.28.0.10.5000: Flags [P.], seq 101201:104097, ack 3, win 502, options [nop,nop,TS val 2753937273 ecr 3502798822], length 2896
77,00:25:49.858576 IP 172.28.0.20.59488 > 172.28.0.10.5000: Flags [P.], seq 104097:106993, ack 3, win 502, options [nop,nop,TS val 2753937273 ecr 3502798822], length 2896
78,00:25:49.883583 IP 172.28.0.10.5000 > 172.28.0.20.59488: Flags [.], ack 101201, win 1162, options [nop,nop,TS val 3502798872 ecr 2753937273], length 0
79,00:25:49.883590 IP 172.28.0.10.5000 > 172.28.0.20.59488: Flags [.], ack 104097, win 1207, options [nop,nop,TS val 3502798872 ecr 2753937273], length 0
80,00:25:49.883592 IP 172.28.0.10.5000 > 172.28.0.20.59488: Flags [.], ack 106993, win 1252, options [nop,nop,TS val 3502798872 ecr 2753937273], length 0
81,00:25:49.908668 IP 172.28.0.20.59488 > 172.28.0.10.5000: Flags [P.], seq 106993:109889, ack 3, win 502, options [nop,nop,TS val 2753937323 ecr 3502798872], length 2896
82,00:25:49.908688 IP 172.28.0.20.59488 > 172.28.0.10.5000: Flags [P.], seq 109889:112785, ack 3, win 502, options [nop,nop,TS val 2753937323 ecr 3502798872], length 2896
83,00:25:49.908696 IP 172.28.0.20.59488 > 172.28.0.10.5000: Flags [P.], seq 112785:115681, ack 3, win 502, options [nop,nop,TS val 2753937323 ecr 3502798872], length 2896
84,00:25:49.933720 IP 172.28.0.10.5000 > 172.28.0.20.59488: Flags [.], ack 109889, win 1297, options [nop,nop,TS val 3502798922 ecr 2753937323], length 0
85,00:25:49.933727 IP 172.28.0.10.5000 > 172.28.0.20.59488: Flags [.], ack 112785, win 1313, options [nop,nop,TS val 3502798922 ecr 2753937323], length 0
86,00:25:49.933782 IP 172.28.0.10.5000 > 172.28.0.20.59488: Flags [.], ack 115681, win 1313, options [nop,nop,TS val 3502798922 ecr 2753937323], length 0
87,00:25:49.958828 IP 172.28.0.20.59488 > 172.28.0.10.5000: Flags [P.], seq 115681:118577, ack 3, win 502, options [nop,nop,TS val 2753937373 ecr 3502798922], length 2896
88,00:25:49.958858 IP 172.28.0.20.59488 > 172.28.0.10.5000: Flags [P.], seq 118577:121473, ack 3, win 502, options [nop,nop,TS val 2753937373 ecr 3502798922], length 2896
89,00:25:49.958864 IP 172.28.0.20.59488 > 172.28.0.10.5000: Flags [P.], seq 121473:124369, ack 3, win 502, options [nop,nop,TS val 2753937373 ecr 3502798922], length 2896
90,00:25:49.983889 IP 172.28.0.10.5000 > 172.28.0.20.59488: Flags [.], ack 118577, win 1335, options [nop,nop,TS val 3502798972 ecr 2753937373], length 0
91,00:25:49.983892 IP 172.28.0.10.5000 > 172.28.0.20.59488: Flags [.], ack 124369, win 1313, options [nop,nop,TS val 3502798972 ecr 2753937373], length 0
92,00:25:50.008993 IP 172.28.0.20.59488 > 172.28.0.10.5000: Flags [P.], seq 124369:127265, ack 3, win 502, options [nop,nop,TS val 2753937423 ecr 3502798972], length 2896
93,00:25:50.009026 IP 172.28.0.20.59488 > 172.28.0.10.5000: Flags [.], seq 127265:128713, ack 3, win 502, options [nop,nop,TS val 2753937423 ecr 3502798972], length 1448
94,00:25:50.009032 IP 172.28.0.20.59488 > 172.28.0.10.5000: Flags [P.], seq 128713:131609, ack 3, win 502, options [nop,nop,TS val 2753937423 ecr 3502798972], length 2896
95,00:25:50.009036 IP 172.28.0.20.59488 > 172.28.0.10.5000: Flags [P.], seq 131609:134505, ack 3, win 502, options [nop,nop,TS val 2753937423 ecr 3502798972], length 2896
96,00:25:50.009039 IP 172.28.0.20.59488 > 172.28.0.10.5000: Flags [.], seq 134505:135953, ack 3, win 502, options [nop,nop,TS val 2753937423 ecr 3502798972], length 1448
97,00:25:50.034060 IP 172.28.0.10.5000 > 172.28.0.20.59488: Flags [.], ack 127265, win 1335, options [nop,nop,TS val 3502799022 ecr 2753937423], length 0
98,00:25:50.034064 IP 172.28.0.10.5000 > 172.28.0.20.59488: Flags [.], ack 131609, win 1302, options [nop,nop,TS val 3502799022 ecr 2753937423], length 0
99,00:25:50.034139 IP 172.28.0.10.5000 > 172.28.0.20.59488: Flags [.], ack 135953, win 1321, options [nop,nop,TS val 3502799023 ecr 2753937423], length 0
100,00:25:50.059167 IP 172.28.0.20.59488 > 172.28.0.10.5000: Flags [P.], seq 135953:138849, ack 3, win 502, options [nop,nop,TS val 2753937474 ecr 3502799022], length 2896
101,00:25:50.059195 IP 172.28.0.20.59488 > 172.28.0.10.5000: Flags [P.], seq 138849:141745, ack 3, win 502, options [nop,nop,TS val 2753937474 ecr 3502799022], length 2896
102,00:25:50.059210 IP 172.28.0.20.59488 > 172.28.0.10.5000: Flags [P.], seq 141745:144641, ack 3, win 502, options [nop,nop,TS val 2753937474 ecr 3502799023], length 2896
103,00:25:50.059213 IP 172.28.0.20.59488 > 172.28.0.10.5000: Flags [P.], seq 144641:147537, ack 3, win 502, options [nop,nop,TS val 2753937474 ecr 3502799023], length 2896
104,00:25:50.084201 IP 172.28.0.10.5000 > 172.28.0.20.59488: Flags [.], ack 138849, win 1335, options [nop,nop,TS val 3502799073 ecr 2753937474], length 0
105,00:25:50.084240 IP 172.28.0.10.5000 > 172.28.0.20.59488: Flags [.], ack 141745, win 1335, options [nop,nop,TS val 3502799073 ecr 2753937474], length 0
106,00:25:50.084275 IP 172.28.0.10.5000 > 172.28.0.20.59488: Flags [.], ack 147537, win 1313, options [nop,nop,TS val 3502799073 ecr 2753937474], length 0
107,00:25:50.109270 IP 172.28.0.20.59488 > 172.28.0.10.5000: Flags [P.], seq 147537:150433, ack 3, win 502, options [nop,nop,TS val 2753937524 ecr 3502799073], length 2896
108,00:25:50.109306 IP 172.28.0.20.59488 > 172.28.0.10.5000: Flags [P.], seq 150433:153329, ack 3, win 502, options [nop,nop,TS val 2753937524 ecr 3502799073], length 2896
109,00:25:50.109311 IP 172.28.0.20.59488 > 172.28.0.10.5000: Flags [P.], seq 153329:156225, ack 3, win 502, options [nop,nop,TS val 2753937524 ecr 3502799073], length 2896
110,00:25:50.109315 IP 172.28.0.20.59488 > 172.28.0.10.5000: Flags [P.], seq 156225:159121, ack 3, win 502, options [nop,nop,TS val 2753937524 ecr 3502799073], length 2896
111,00:25:50.134303 IP 172.28.0.10.5000 > 172.28.0.20.59488: Flags [.], ack 150433, win 1335, options [nop,nop,TS val 3502799123 ecr 2753937524], length 0
112,00:25:50.136304 IP 172.28.0.10.5000 > 172.28.0.20.59488: Flags [.], ack 159121, win 1290, options [nop,nop,TS val 3502799125 ecr 2753937524], length 0
113,00:25:50.159375 IP 172.28.0.20.59488 > 172.28.0.10.5000: Flags [P.], seq 159121:162017, ack 3, win 502, options [nop,nop,TS val 2753937574 ecr 3502799123], length 2896
114,00:25:50.161367 IP 172.28.0.20.59488 > 172.28.0.10.5000: Flags [P.], seq 162017:164913, ack 3, win 502, options [nop,nop,TS val 2753937576 ecr 3502799125], length 2896
115,00:25:50.161382 IP 172.28.0.20.59488 > 172.28.0.10.5000: Flags [P.], seq 164913:167809, ack 3, win 502, options [nop,nop,TS val 2753937576 ecr 3502799125], length 2896
116,00:25:50.161387 IP 172.28.0.20.59488 > 172.28.0.10.5000: Flags [P.], seq 167809:170705, ack 3, win 502, options [nop,nop,TS val 2753937576 ecr 3502799125], length 2896
117,00:25:50.184403 IP 172.28.0.10.5000 > 172.28.0.20.59488: Flags [.], ack 162017, win 1335, options [nop,nop,TS val 3502799173 ecr 2753937574], length 0
118,00:25:50.186390 IP 172.28.0.10.5000 > 172.28.0.20.59488: Flags [.], ack 164913, win 1335, options [nop,nop,TS val 3502799175 ecr 2753937576], length 0
119,00:25:50.209472 IP 172.28.0.20.59488 > 172.28.0.10.5000: Flags [P.], seq 170705:173601, ack 3, win 502, options [nop,nop,TS val 2753937624 ecr 3502799173], length 2896
120,00:25:50.209490 IP 172.28.0.20.59488 > 172.28.0.10.5000: Flags [.], seq 173601:175049, ack 3, win 502, options [nop,nop,TS val 2753937624 ecr 3502799173], length 1448
121,00:25:50.211445 IP 172.28.0.20.59488 > 172.28.0.10.5000: Flags [P.], seq 175049:177945, ack 3, win 502, options [nop,nop,TS val 2753937626 ecr 3502799175], length 2896
122,00:25:50.234501 IP 172.28.0.10.5000 > 172.28.0.20.59488: Flags [.], ack 173601, win 1335, options [nop,nop,TS val 3502799223 ecr 2753937624], length 0
123,00:25:50.236467 IP 172.28.0.10.5000 > 172.28.0.20.59488: Flags [.], ack 177945, win 1335, options [nop,nop,TS val 3502799225 ecr 2753937624], length 0
124,00:25:50.259586 IP 172.28.0.20.59488 > 172.28.0.10.5000: Flags [P.], seq 177945:180841, ack 3, win 502, options [nop,nop,TS val 2753937674 ecr 3502799223], length 2896
125,00:25:50.259608 IP 172.28.0.20.59488 > 172.28.0.10.5000: Flags [P.], seq 180841:183737, ack 3, win 502, options [nop,nop,TS val 2753937674 ecr 3502799223], length 2896
126,00:25:50.259612 IP 172.28.0.20.59488 > 172.28.0.10.5000: Flags [.], seq 183737:185185, ack 3, win 502, options [nop,nop,TS val 2753937674 ecr 3502799223], length 1448
127,00:25:50.259615 IP 172.28.0.20.59488 > 172.28.0.10.5000: Flags [.], seq 185185:186633, ack 3, win 502, options [nop,nop,TS val 2753937674 ecr 3502799223], length 1448
128,00:25:50.261512 IP 172.28.0.20.59488 > 172.28.0.10.5000: Flags [P.], seq 186633:189529, ack 3, win 502, options [nop,nop,TS val 2753937676 ecr 3502799225], length 2896
129,00:25:50.284620 IP 172.28.0.10.5000 > 172.28.0.20.59488: Flags [.], ack 180841, win 1335, options [nop,nop,TS val 3502799273 ecr 2753937674], length 0
130,00:25:50.284666 IP 172.28.0.10.5000 > 172.28.0.20.59488: Flags [.], ack 186633, win 1307, options [nop,nop,TS val 3502799273 ecr 2753937674], length 0
131,00:25:50.286536 IP 172.28.0.10.5000 > 172.28.0.20.59488: Flags [.], ack 189529, win 1335, options [nop,nop,TS val 3502799275 ecr 2753937676], length 0
132,00:25:50.309709 IP 172.28.0.20.59488 > 172.28.0.10.5000: Flags [P.], seq 190977:193873, ack 3, win 502, options [nop,nop,TS val 2753937724 ecr 3502799273], length 2896
133,00:25:50.309743 IP 172.28.0.20.59488 > 172.28.0.10.5000: Flags [P.], seq 193873:196769, ack 3, win 502, options [nop,nop,TS val 2753937724 ecr 3502799273], length 2896
134,00:25:50.309750 IP 172.28.0.20.59488 > 172.28.0.10.5000: Flags [P.], seq 196769:199665, ack 3, win 502, options [nop,nop,TS val 2753937724 ecr 3502799273], length 2896
135,00:25:50.334762 IP 172.28.0.10.5000 > 172.28.0.20.59488: Flags [.], ack 189529, win 1335, options [nop,nop,TS val 3502799323 ecr 2753937676,nop,nop,sack 1 {190977:196769}], length 0
136,00:25:50.334767 IP 172.28.0.10.5000 > 172.28.0.20.59488: Flags [.], ack 189529, win 1335, options [nop,nop,TS val 3502799323 ecr 2753937676,nop,nop,sack 1 {190977:199665}], length 0
137,00:25:50.359877 IP 172.28.0.20.59488 > 172.28.0.10.5000: Flags [.], seq 189529:190977, ack 3, win 502, options [nop,nop,TS val 2753937774 ecr 3502799323], length 1448
138,00:25:50.359910 IP 172.28.0.20.59488 > 172.28.0.10.5000: Flags [.], seq 202561:204009, ack 3, win 502, options [nop,nop,TS val 2753937774 ecr 3502799323], length 1448
139,00:25:50.359917 IP 172.28.0.20.59488 > 172.28.0.10.5000: Flags [P.], seq 204009:206905, ack 3, win 502, options [nop,nop,TS val 2753937774 ecr 3502799323], length 2896
140,00:25:50.384931 IP 172.28.0.10.5000 > 172.28.0.20.59488: Flags [.], ack 199665, win 1287, options [nop,nop,TS val 3502799373 ecr 2753937774], length 0
141,00:25:50.384937 IP 172.28.0.10.5000 > 172.28.0.20.59488: Flags [.], ack 199665, win 1287, options [nop,nop,TS val 3502799373 ecr 2753937774,nop,nop,sack 1 {202561:204009}], length 0
142,00:25:50.384938 IP 172.28.0.10.5000 > 172.28.0.20.59488: Flags [.], ack 199665, win 1287, options [nop,nop,TS val 3502799373 ecr 2753937774,nop,nop,sack 1 {202561:206905}], length 0
143,00:25:50.410064 IP 172.28.0.20.59488 > 172.28.0.10.5000: Flags [P.], seq 199665:202561, ack 3, win 502, options [nop,nop,TS val 2753937824 ecr 3502799373], length 2896
144,00:25:50.410109 IP 172.28.0.20.59488 > 172.28.0.10.5000: Flags [.], seq 206905:208353, ack 3, win 502, options [nop,nop,TS val 2753937824 ecr 3502799373], length 1448
145,00:25:50.410114 IP 172.28.0.20.59488 > 172.28.0.10.5000: Flags [.], seq 208353:209801, ack 3, win 502, options [nop,nop,TS val 2753937824 ecr 3502799373], length 1448
146,00:25:50.410117 IP 172.28.0.20.59488 > 172.28.0.10.5000: Flags [P.], seq 209801:212697, ack 3, win 502, options [nop,nop,TS val 2753937824 ecr 3502799373], length 2896
147,00:25:50.435125 IP 172.28.0.10.5000 > 172.28.0.20.59488: Flags [.], ack 206905, win 1304, options [nop,nop,TS val 3502799423 ecr 2753937824], length 0
148,00:25:50.435662 IP 172.28.0.10.5000 > 172.28.0.20.59488: Flags [.], ack 212697, win 1293, options [nop,nop,TS val 3502799424 ecr 2753937824], length 0
149,00:25:50.460227 IP 172.28.0.20.59488 > 172.28.0.10.5000: Flags [P.], seq 212697:215593, ack 3, win 502, options [nop,nop,TS val 2753937875 ecr 3502799423], length 2896
150,00:25:50.460715 IP 172.28.0.20.59488 > 172.28.0.10.5000: Flags [P.], seq 215593:218489, ack 3, win 502, options [nop,nop,TS val 2753937875 ecr 3502799424], length 2896
151,00:25:50.460730 IP 172.28.0.20.59488 > 172.28.0.10.5000: Flags [P.], seq 218489:221385, ack 3, win 502, options [nop,nop,TS val 2753937875 ecr 3502799424], length 2896
152,00:25:50.460735 IP 172.28.0.20.59488 > 172.28.0.10.5000: Flags [.], seq 221385:222833, ack 3, win 502, options [nop,nop,TS val 2753937875 ecr 3502799424], length 1448
153,00:25:50.485265 IP 172.28.0.10.5000 > 172.28.0.20.59488: Flags [.], ack 215593, win 1335, options [nop,nop,TS val 3502799474 ecr 2753937875], length 0
154,00:25:50.486018 IP 172.28.0.10.5000 > 172.28.0.20.59488: Flags [.], ack 222833, win 1321, options [nop,nop,TS val 3502799474 ecr 2753937875], length 0
155,00:25:50.510336 IP 172.28.0.20.59488 > 172.28.0.10.5000: Flags [P.], seq 222833:225729, ack 3, win 502, options [nop,nop,TS val 2753937925 ecr 3502799474], length 2896
156,00:25:50.511069 IP 172.28.0.20.59488 > 172.28.0.10.5000: Flags [P.], seq 225729:228625, ack 3, win 502, options [nop,nop,TS val 2753937925 ecr 3502799474], length 2896
157,00:25:50.511086 IP 172.28.0.20.59488 > 172.28.0.10.5000: Flags [P.], seq 228625:231521, ack 3, win 502, options [nop,nop,TS val 2753937925 ecr 3502799474], length 2896
158,00:25:50.511104 IP 172.28.0.20.59488 > 172.28.0.10.5000: Flags [.], seq 231521:232969, ack 3, win 502, options [nop,nop,TS val 2753937925 ecr 3502799474], length 1448
159,00:25:50.535370 IP 172.28.0.10.5000 > 172.28.0.20.59488: Flags [.], ack 225729, win 1335, options [nop,nop,TS val 3502799524 ecr 2753937925], length 0
160,00:25:50.536105 IP 172.28.0.10.5000 > 172.28.0.20.59488: Flags [.], ack 228625, win 1335, options [nop,nop,TS val 3502799524 ecr 2753937925], length 0
161,00:25:50.536357 IP 172.28.0.10.5000 > 172.28.0.20.59488: Flags [.], ack 232969, win 1321, options [nop,nop,TS val 3502799525 ecr 2753937925], length 0
162,00:25:50.560442 IP 172.28.0.20.59488 > 172.28.0.10.5000: Flags [P.], seq 232969:235865, ack 3, win 502, options [nop,nop,TS val 2753937975 ecr 3502799524], length 2896
163,00:25:50.561152 IP 172.28.0.20.59488 > 172.28.0.10.5000: Flags [P.], seq 235865:238761, ack 3, win 502, options [nop,nop,TS val 2753937976 ecr 3502799524], length 2896
164,00:25:50.561398 IP 172.28.0.20.59488 > 172.28.0.10.5000: Flags [P.], seq 238761:241657, ack 3, win 502, options [nop,nop,TS val 2753937976 ecr 3502799525], length 2896
165,00:25:50.561410 IP 172.28.0.20.59488 > 172.28.0.10.5000: Flags [.], seq 241657:243105, ack 3, win 502, options [nop,nop,TS val 2753937976 ecr 3502799525], length 1448
166,00:25:50.585474 IP 172.28.0.10.5000 > 172.28.0.20.59488: Flags [.], ack 235865, win 1335, options [nop,nop,TS val 3502799574 ecr 2753937975], length 0
167,00:25:50.586175 IP 172.28.0.10.5000 > 172.28.0.20.59488: Flags [.], ack 238761, win 1335, options [nop,nop,TS val 3502799575 ecr 2753937976], length 0
168,00:25:50.586419 IP 172.28.0.10.5000 > 172.28.0.20.59488: Flags [.], ack 241657, win 1335, options [nop,nop,TS val 3502799575 ecr 2753937976], length 0
169,00:25:50.610544 IP 172.28.0.20.59488 > 172.28.0.10.5000: Flags [P.], seq 243105:246001, ack 3, win 502, options [nop,nop,TS val 2753938025 ecr 3502799574], length 2896
170,00:25:50.611217 IP 172.28.0.20.59488 > 172.28.0.10.5000: Flags [P.], seq 246001:248897, ack 3, win 502, options [nop,nop,TS val 2753938026 ecr 3502799575], length 2896
171,00:25:50.611460 IP 172.28.0.20.59488 > 172.28.0.10.5000: Flags [P.], seq 248897:251793, ack 3, win 502, options [nop,nop,TS val 2753938026 ecr 3502799575], length 2896
172,00:25:50.627128 IP 172.28.0.10.5000 > 172.28.0.20.59488: Flags [.], ack 243105, win 1358, options [nop,nop,TS val 3502799616 ecr 2753937976], length 0
173,00:25:50.636192 IP 172.28.0.10.5000 > 172.28.0.20.59488: Flags [.], ack 246001, win 1358, options [nop,nop,TS val 3502799625 ecr 2753938025], length 0
174,00:25:50.636245 IP 172.28.0.10.5000 > 172.28.0.20.59488: Flags [.], ack 248897, win 1358, options [nop,nop,TS val 3502799625 ecr 2753938026], length 0
175,00:25:50.652202 IP 172.28.0.20.59488 > 172.28.0.10.5000: Flags [P.], seq 251793:254689, ack 3, win 502, options [nop,nop,TS val 2753938067 ecr 3502799616], length 2896
176,00:25:50.661250 IP 172.28.0.20.59488 > 172.28.0.10.5000: Flags [P.], seq 254689:257585, ack 3, win 502, options [nop,nop,TS val 2753938076 ecr 3502799625], length 2896
177,00:25:50.661275 IP 172.28.0.20.59488 > 172.28.0.10.5000: Flags [P.], seq 257585:260481, ack 3, win 502, options [nop,nop,TS val 2753938076 ecr 3502799625], length 2896
178,00:25:50.677237 IP 172.28.0.10.5000 > 172.28.0.20.59488: Flags [.], ack 254689, win 1358, options [nop,nop,TS val 3502799666 ecr 2753938067], length 0
179,00:25:50.687137 IP 172.28.0.10.5000 > 172.28.0.20.59488: Flags [.], ack 260481, win 1335, options [nop,nop,TS val 3502799676 ecr 2753938076], length 0
180,00:25:50.702308 IP 172.28.0.20.59488 > 172.28.0.10.5000: Flags [P.], seq 260481:263377, ack 3, win 502, options [nop,nop,TS val 2753938117 ecr 3502799666], length 2896
181,00:25:50.702332 IP 172.28.0.20.59488 > 172.28.0.10.5000: Flags [P.], seq 263377:266273, ack 3, win 502, options [nop,nop,TS val 2753938117 ecr 3502799666], length 2896
182,00:25:50.712200 IP 172.28.0.20.59488 > 172.28.0.10.5000: Flags [P.], seq 266273:269169, ack 3, win 502, options [nop,nop,TS val 2753938127 ecr 3502799676], length 2896
183,00:25:50.712218 IP 172.28.0.20.59488 > 172.28.0.10.5000: Flags [P.], seq 269169:272065, ack 3, win 502, options [nop,nop,TS val 2753938127 ecr 3502799676], length 2896
184,00:25:50.727343 IP 172.28.0.10.5000 > 172.28.0.20.59488: Flags [.], ack 263377, win 1335, options [nop,nop,TS val 3502799716 ecr 2753938117], length 0
185,00:25:50.728508 IP 172.28.0.10.5000 > 172.28.0.20.59488: Flags [.], ack 266273, win 1335, options [nop,nop,TS val 3502799717 ecr 2753938117], length 0
186,00:25:50.737227 IP 172.28.0.10.5000 > 172.28.0.20.59488: Flags [.], ack 269169, win 1335, options [nop,nop,TS val 3502799726 ecr 2753938127], length 0
187,00:25:50.737261 IP 172.28.0.10.5000 > 172.28.0.20.59488: Flags [.], ack 272065, win 1335, options [nop,nop,TS val 3502799726 ecr 2753938127], length 0
188,00:25:50.752407 IP 172.28.0.20.59488 > 172.28.0.10.5000: Flags [P.], seq 272065:274961, ack 3, win 502, options [nop,nop,TS val 2753938167 ecr 3502799716], length 2896
189,00:25:50.753555 IP 172.28.0.20.59488 > 172.28.0.10.5000: Flags [P.], seq 274961:277857, ack 3, win 502, options [nop,nop,TS val 2753938168 ecr 3502799717], length 2896
190,00:25:50.762289 IP 172.28.0.20.59488 > 172.28.0.10.5000: Flags [P.], seq 277857:280753, ack 3, win 502, options [nop,nop,TS val 2753938177 ecr 3502799726], length 2896
191,00:25:50.762323 IP 172.28.0.20.59488 > 172.28.0.10.5000: Flags [P.], seq 280753:283649, ack 3, win 502, options [nop,nop,TS val 2753938177 ecr 3502799726], length 2896
192,00:25:50.777440 IP 172.28.0.10.5000 > 172.28.0.20.59488: Flags [.], ack 274961, win 1335, options [nop,nop,TS val 3502799766 ecr 2753938167], length 0
193,00:25:50.778578 IP 172.28.0.10.5000 > 172.28.0.20.59488: Flags [.], ack 277857, win 1335, options [nop,nop,TS val 3502799767 ecr 2753938168], length 0
194,00:25:50.787322 IP 172.28.0.10.5000 > 172.28.0.20.59488: Flags [.], ack 280753, win 1335, options [nop,nop,TS val 3502799776 ecr 2753938177], length 0
195,00:25:50.787352 IP 172.28.0.10.5000 > 172.28.0.20.59488: Flags [.], ack 283649, win 1335, options [nop,nop,TS val 3502799776 ecr 2753938177], length 0
196,00:25:50.802514 IP 172.28.0.20.59488 > 172.28.0.10.5000: Flags [P.], seq 283649:286545, ack 3, win 502, options [nop,nop,TS val 2753938217 ecr 3502799766], length 2896
197,00:25:50.802537 IP 172.28.0.20.59488 > 172.28.0.10.5000: Flags [.], seq 286545:287993, ack 3, win 502, options [nop,nop,TS val 2753938217 ecr 3502799766], length 1448
198,00:25:50.803623 IP 172.28.0.20.59488 > 172.28.0.10.5000: Flags [P.], seq 287993:290889, ack 3, win 502, options [nop,nop,TS val 2753938218 ecr 3502799767], length 2896
199,00:25:50.812368 IP 172.28.0.20.59488 > 172.28.0.10.5000: Flags [P.], seq 290889:293785, ack 3, win 502, options [nop,nop,TS val 2753938227 ecr 3502799776], length 2896
200,00:25:50.827542 IP 172.28.0.10.5000 > 172.28.0.20.59488: Flags [.], ack 286545, win 1335, options [nop,nop,TS val 3502799816 ecr 2753938217], length 0
201,00:25:50.828642 IP 172.28.0.10.5000 > 172.28.0.20.59488: Flags [.], ack 290889, win 1335, options [nop,nop,TS val 3502799817 ecr 2753938217], length 0
202,00:25:50.837397 IP 172.28.0.10.5000 > 172.28.0.20.59488: Flags [.], ack 293785, win 1335, options [nop,nop,TS val 3502799826 ecr 2753938227], length 0
203,00:25:50.852596 IP 172.28.0.20.59488 > 172.28.0.10.5000: Flags [P.], seq 296681:299577, ack 3, win 502, options [nop,nop,TS val 2753938267 ecr 3502799816], length 2896
204,00:25:50.853681 IP 172.28.0.20.59488 > 172.28.0.10.5000: Flags [P.], seq 299577:302473, ack 3, win 502, options [nop,nop,TS val 2753938268 ecr 3502799817], length 2896
205,00:25:50.853687 IP 172.28.0.20.59488 > 172.28.0.10.5000: Flags [.], seq 302473:303921, ack 3, win 502, options [nop,nop,TS val 2753938268 ecr 3502799817], length 1448
206,00:25:50.862437 IP 172.28.0.20.59488 > 172.28.0.10.5000: Flags [P.], seq 303921:306817, ack 3, win 502, options [nop,nop,TS val 2753938277 ecr 3502799826], length 2896
207,00:25:50.877621 IP 172.28.0.10.5000 > 172.28.0.20.59488: Flags [.], ack 293785, win 1335, options [nop,nop,TS val 3502799866 ecr 2753938227,nop,nop,sack 1 {296681:299577}], length 0
208,00:25:50.878693 IP 172.28.0.10.5000 > 172.28.0.20.59488: Flags [.], ack 293785, win 1335, options [nop,nop,TS val 3502799867 ecr 2753938227,nop,nop,sack 1 {296681:302473}], length 0
209,00:25:50.878694 IP 172.28.0.10.5000 > 172.28.0.20.59488: Flags [.], ack 293785, win 1335, options [nop,nop,TS val 3502799867 ecr 2753938227,nop,nop,sack 1 {296681:303921}], length 0
210,00:25:50.888560 IP 172.28.0.10.5000 > 172.28.0.20.59488: Flags [.], ack 293785, win 1335, options [nop,nop,TS val 3502799876 ecr 2753938227,nop,nop,sack 1 {296681:306817}], length 0
211,00:25:50.903738 IP 172.28.0.20.59488 > 172.28.0.10.5000: Flags [.], seq 306817:308265, ack 3, win 502, options [nop,nop,TS val 2753938318 ecr 3502799867], length 1448
212,00:25:50.903746 IP 172.28.0.20.59488 > 172.28.0.10.5000: Flags [.], seq 308265:309713, ack 3, win 502, options [nop,nop,TS val 2753938318 ecr 3502799867], length 1448
213,00:25:50.913618 IP 172.28.0.20.59488 > 172.28.0.10.5000: Flags [P.], seq 309713:312609, ack 3, win 502, options [nop,nop,TS val 2753938328 ecr 3502799876], length 2896
214,00:25:50.929865 IP 172.28.0.10.5000 > 172.28.0.20.59488: Flags [.], ack 293785, win 1335, options [nop,nop,TS val 3502799917 ecr 2753938227,nop,nop,sack 1 {296681:309713}], length 0
215,00:25:50.939769 IP 172.28.0.10.5000 > 172.28.0.20.59488: Flags [.], ack 293785, win 1335, options [nop,nop,TS val 3502799927 ecr 2753938227,nop,nop,sack 1 {296681:312609}], length 0
216,00:25:50.954942 IP 172.28.0.20.59488 > 172.28.0.10.5000: Flags [.], seq 293785:295233, ack 3, win 502, options [nop,nop,TS val 2753938369 ecr 3502799917], length 1448
217,00:25:50.954964 IP 172.28.0.20.59488 > 172.28.0.10.5000: Flags [.], seq 295233:296681, ack 3, win 502, options [nop,nop,TS val 2753938369 ecr 3502799917], length 1448
218,00:25:50.954977 IP 172.28.0.20.59488 > 172.28.0.10.5000: Flags [.], seq 312609:314057, ack 3, win 502, options [nop,nop,TS val 2753938369 ecr 3502799917], length 1448
219,00:25:50.964848 IP 172.28.0.20.59488 > 172.28.0.10.5000: Flags [P.], seq 314057:316953, ack 3, win 502, options [nop,nop,TS val 2753938379 ecr 3502799927], length 2896
220,00:25:50.979981 IP 172.28.0.10.5000 > 172.28.0.20.59488: Flags [.], ack 295233, win 1324, options [nop,nop,TS val 3502799968 ecr 2753938369,nop,nop,sack 1 {296681:312609}], length 0
221,00:25:50.979985 IP 172.28.0.10.5000 > 172.28.0.20.59488: Flags [.], ack 312609, win 1231, options [nop,nop,TS val 3502799968 ecr 2753938369], length 0
222,00:25:50.989891 IP 172.28.0.10.5000 > 172.28.0.20.59488: Flags [.], ack 316953, win 1335, options [nop,nop,TS val 3502799978 ecr 2753938369], length 0
223,00:25:51.005068 IP 172.28.0.20.59488 > 172.28.0.10.5000: Flags [P.], seq 316953:319849, ack 3, win 502, options [nop,nop,TS val 2753938419 ecr 3502799968], length 2896
224,00:25:51.005144 IP 172.28.0.20.59488 > 172.28.0.10.5000: Flags [.], seq 319849:321297, ack 3, win 502, options [nop,nop,TS val 2753938419 ecr 3502799968], length 1448
225,00:25:51.014959 IP 172.28.0.20.59488 > 172.28.0.10.5000: Flags [P.], seq 321297:324193, ack 3, win 502, options [nop,nop,TS val 2753938429 ecr 3502799978], length 2896
226,00:25:51.014981 IP 172.28.0.20.59488 > 172.28.0.10.5000: Flags [.], seq 324193:325641, ack 3, win 502, options [nop,nop,TS val 2753938429 ecr 3502799978], length 1448
227,00:25:51.030124 IP 172.28.0.10.5000 > 172.28.0.20.59488: Flags [.], ack 319849, win 1335, options [nop,nop,TS val 3502800018 ecr 2753938419], length 0
228,00:25:51.039992 IP 172.28.0.10.5000 > 172.28.0.20.59488: Flags [.], ack 324193, win 1335, options [nop,nop,TS val 3502800028 ecr 2753938419], length 0
229,00:25:51.055191 IP 172.28.0.20.59488 > 172.28.0.10.5000: Flags [P.], seq 325641:328537, ack 3, win 502, options [nop,nop,TS val 2753938470 ecr 3502800018], length 2896
230,00:25:51.055208 IP 172.28.0.20.59488 > 172.28.0.10.5000: Flags [.], seq 328537:329985, ack 3, win 502, options [nop,nop,TS val 2753938470 ecr 3502800018], length 1448
231,00:25:51.065046 IP 172.28.0.20.59488 > 172.28.0.10.5000: Flags [P.], seq 329985:332881, ack 3, win 502, options [nop,nop,TS val 2753938479 ecr 3502800028], length 2896
232,00:25:51.065058 IP 172.28.0.20.59488 > 172.28.0.10.5000: Flags [.], seq 332881:334329, ack 3, win 502, options [nop,nop,TS val 2753938479 ecr 3502800028], length 1448
233,00:25:51.080113 IP 172.28.0.10.5000 > 172.28.0.20.59488: Flags [.], ack 325641, win 1358, options [nop,nop,TS val 3502800069 ecr 2753938429], length 0
234,00:25:51.080234 IP 172.28.0.10.5000 > 172.28.0.20.59488: Flags [.], ack 329985, win 1344, options [nop,nop,TS val 3502800069 ecr 2753938470], length 0
235,00:25:51.090082 IP 172.28.0.10.5000 > 172.28.0.20.59488: Flags [.], ack 334329, win 1344, options [nop,nop,TS val 3502800078 ecr 2753938479], length 0
236,00:25:51.105183 IP 172.28.0.20.59488 > 172.28.0.10.5000: Flags [.], seq 334329:335777, ack 3, win 502, options [nop,nop,TS val 2753938520 ecr 3502800069], length 1448
237,00:25:51.105268 IP 172.28.0.20.59488 > 172.28.0.10.5000: Flags [P.], seq 335777:338673, ack 3, win 502, options [nop,nop,TS val 2753938520 ecr 3502800069], length 2896
238,00:25:51.105278 IP 172.28.0.20.59488 > 172.28.0.10.5000: Flags [.], seq 338673:340121, ack 3, win 502, options [nop,nop,TS val 2753938520 ecr 3502800069], length 1448
239,00:25:51.115136 IP 172.28.0.20.59488 > 172.28.0.10.5000: Flags [P.], seq 340121:343017, ack 3, win 502, options [nop,nop,TS val 2753938530 ecr 3502800078], length 2896
